id,reservation_id,booking_id,listing_id,unit_id,geo_id,reservation_checkin,reservation_checkout,reservation_confirmation_code,overall_rating,accuracy_rating,checkin_rating,cleanliness_rating,communication_rating,location_rating,value_rating,comments,private_feedback,accuracy_comments,checkin_comments,cleanliness_comments,communication_comments,location_comments,improve_comments,value_comments,love_comments,accuracy_tags,appreciation_tags,cleanliness_tags,checkin_tags,essential_amenities_tags,communication_tags,review_highlight_tags,reviewer_id,first_name,last_name,profile_pic_url,sent_slack,job_id
645461541,3029779461,14178865,36693625,101076,1,2020-07-31,2020-08-02,HMJPWYZQM4,1,1,5,1,1,1,1,"Let me first start by saying that i hadn’t checked into my stay until 10:45 PM on July 31st, 2020. and I checked in with a very pleasant woman. 

The walls themselves were dirty and we noticed the second we walked in, but we didn’t pay much attention. When i walked into the bedroom the towels were dingy and hair hair in them. The shower curtain was yellow and orange, with hair in the shower as well. There were dirty handprints above the bed I was expected to sleep in. In The kitchen, the sponge was not replaced so I can only imagine how dirty the dishes were. In the unc leaned freezer, the ice tray was half full and look as if it was used as an ashtray or something.. the previous occupants left 3 uncased beer. And the microwave was BARELY in working condition. There was a fist print in the refrigerator and the A/C was not dusted. Immediately upon noticing all of these things, I contacted a Zencity rep through the Airbnb app and he had me send pictures and seemed as if he wanted to be helpful. It was going smooth until I was told that he “didn’t understand what was wrong from the pictures that I sent” so I called. While on hold on the FIRST call, I walked downstairs to speak with the lady that I checked in with, but she was no longer there there was a young man and he was very helpful he provided me a different number. One that I hadn’t called already. I got a little further this call, they told me they they would have a property manager call me. I ATTEMPTED to express my concerns with him.. frustrated? YES. frantic? YES because it was very hard to even get to speak with him. He immediately cut me off and said “ma’am, ma’am.. you need to calm down” and proceeded to tell me how he had complaints about me harassing and threatening door staff. (which NEVER happened. Even after everything was settled I spoke with the gentleman who only gave me a phone number and was MORE than compassionate and understanding) the Property manager that I spoke with, Gary, told me that security was notified of these false allegations and that they were going to come up and, AND I QUOTE, ‘DRAG’ me off the property. I’m not sure if that’s how they run their business but I want no parts and I don’t want anyone else to have to encounter this unprofessional business! 

Not to mention the time i was lied to; 

When speaking with the Zencity rep through the AirBNB app, he told me that the room was cleaned THE DAY that I checked in, (7/31/20) but the whiteboard posted had the date (7/29/20) on it... 

All in all AirBNB was extremely helpful in getting me my money back! he was friendly and responded to me in a very timely manner so that i wasn’t without somewhere to stay my first night in Chicago! He even gave me a voucher for my next stay. So i was satisfied in the end.",,null,,,,,,,,[],[],[],[],[],[],null,261728273,Nakajah,Veal,https://a0.muscache.com/im/pictures/user/15594803-f108-49a4-b1fc-f3cba9e52aa5.jpg?aki_policy=profile_x_medium,false,5f23448e9e684e51e18fe347
447989700,1324385755,11082832,33618775,92509,1,2019-04-29,2019-05-04,HMADXZMN55,2,4,1,5,1,5,3,"To be honest, this was MY WORST AirBNB EXPERIENCE. I was completely shocked because I use AirBNB more than the typical hotel & I've never experienced anything like this through AirBNB. For starters, check in was a little off. You had to go from one building to another just to retrieve the key. I was traveling with Uber & extra stops means more money paid. I'm sure they are able to install a similar lockbox with check in keys in the actual building where the guest will be staying. Also, this listing needs more cookware for the kitchen. Being vegan, I make my own meals & would have had to buy a set of knives & other utensils if I decided to cook. My biggest issue was dealing with the unprofesional employees that I had to communicate with during my stay. They made my stay extremely stressful. Their responses were very slow which caused me to almost be in really bad position(outside on the streets with no where to go). I had to threaten to leave a 1 star rating to get any assistance from a manager and the problems just continued even after I was gone. This is a long review but it isn't even HALF of what I experienced while being here. It all would be too long to describe in full. I did enjoy the speaker they had in the apartment, the location & the decor. Wouldn't stay with Zencity again & def wouldn't recommend to anyone else",,null,Check in was super inconvenient,,Poor customer service,,,,,[],[],[],[],[],[],null,172616843,Raven,Simone,https://a0.muscache.com/im/pictures/user/1b3da497-62eb-408c-a5cd-8d416f1c0e05.jpg?aki_policy=profile_x_medium,true,lJNIgQYrIB
616427415,2645244107,13223899,38268915,103654,2,2020-03-07,2020-03-09,HMSBKP2K2J,1,2,3,1,1,5,1,"Our stay in this place was supposed to be a joyful one. We came for a few days to celebrate my daughters’ birthday. This place is very close to Barnes hospital which made it a perfect location to get together. 
It was very disappointing from the beginning. The bathroom was not cleaned and full of hair from the previous guest. A set of dirty linens was thrown in the closet if bedroom number one and in bedroom number 2 the linens were full of hairs.
The company’s response was slow and unapologetic and they did nothing to remediate the situation. We had to buy our own sheets. The next day they came to clean but, in spite of our request, they did not leave toilet paper.
Avoid this place at all cost.",,null,The WiFi was not working. The username and password was incorrect,The unit was not cleaned after the previous guest left. The linens were not changed and the bathroom was full of hairs from the previous guest. We had to buy our own toilet paper,The host kept avoiding the issue of dirty linens and bathroom. They insisted that we make the bed with a non existing spare set of linens. Actually there were dirty linens crumpled up in the closet.,,,A clean space and a more responsive host. We will never again stay with this company.,,[],[],"[""Bathroom"", ""Bedroom"", ""Entire place""]",["Incorrect information"],[],["Host didn’t respond"],"{""title"": ""Feedback"", ""highlightKey"": ""feedback"", ""localizedTags"": []}",85359935,Delia,Leon De Cameo,https://a0.muscache.com/im/pictures/user/e8b86cde-7677-43aa-8a97-d67e6fb2b9ad.jpg?aki_policy=profile_x_medium,true,5e62db118fb3ad75bd1fc804
441075293,1257086490,10951523,31435064,87236,1,2019-04-16,2019-04-21,HMAQSKAHEM,1,1,3,1,1,4,1,"This was by far my worst AirBnB experience and I can only advise everybody else to not make the same mistake and book the apartment. 
The entire apartment was extremely unhygienic and dirty - there were hairs and even traces of food in both of the beds. In addition, the floor had obviously not been cleaned and the table in the living room was so dirty that we couldn't even put our things on it. 
When I informed Zencity about these issues, they did not take any action, regardless of the exorbitant price that we paid for the apartment. Once I brought attention to this problem again, they stopped replying at all, so don't except any cooperation or assistance from their side. Is that how you treat your customers? 
The final disappointed happened the day of our check-out. We were supposed to leave at 11 am. However, Zencity's cleaning staff entered the apartment about half an hour earlier without a warning. At that time, I was coming right out of the shower, covered with nothing but a towel. I felt extremely violated in my privacy. 
All in all, our stay has been beyond terrible and I certainly can't recommend neither the apartment nor the host.",I am still waiting to hear back from you.,null,,,,,,,,[],[],[],[],[],[],null,166944322,Lenny,Gehr,https://a0.muscache.com/im/pictures/user/daa8f033-6fa7-447b-9bef-69e34d200bf9.jpg?aki_policy=profile_x_medium,true,tkEksAd1WR
617317015,2811895164,13496914,25983938,76048,1,2020-03-09,2020-03-12,HM4YPBP9BF,2,1,3,1,1,4,4,"Stay away. These places are not clean like they are said to be. I have videos and photos on my phone of how nasty the rooms were. I had 2 different rooms. Also, my wallet and license and ID along with 3 bank cards of mine were stolen from my room. I was the only one I my room besides Zencitys house maid. I spoke with Marty who is 1 of the owners of the apartment and he had a total attitude and did NOTHING about my things. He was suppose to call me back but after waiting for his call for almost a week I decided to call him back just for him to not even remember who I was. That showed right there that he didn't give a damN about my items missing from my room with only his personnel having access to my room... Makes me wonder if they go around scamming & frauding people. I will never stay in ZenCity properties again! I will also tell my friends & family to avoid them as well.",,null,"So much, too frustrated to write.",Bathtub wasn't clean. Inside of microwave wasn't clean. The refrigerator wasn't clean neither was the bed sheets/blanket or the hangers. So much more besides an unclean room has made this the trip from hell~,"Today is Friday, I have literally been waiting on a call back from Zencity since Monday March 9TH. I've made at least 40 calls to them and even spoketo someone named Marty who was suppose to call me back on Monday as well and I still have yet to hear from him. My wallet, license and ID stolen from the room yet I was there alone! The only person that had access was the cleascleancleaning lady or maid so she called herself. After my wallet was stolen from the room I left my ID in the room hidden since it was the only identification I had left & when I checked out of the room I accidentally left it in there. The same day I went to get it but the security at del prado weren't allowed to let me in to get my ID so I called Zencity management and spoke to Marty (Owner/Manager) letting him know the cleaning guy for the apt was right across the street cleaning another apt & if he could give him the okay to go in the unit I rented and he said NO! After he asked me exactly where I left my ID and he said no theres nothing he can do😡😡😡. I believe he could be using my information & committing fraud. I just dont understand why he wouldn't let the cleaner in so I could get my stuff. I will NEVER stay in any ZenCity properties again! I will also let my friends and family know to NEVER stay in them as well. I also took videos with my phone on how filthy the place was and I had 2 different rooms. They both were dirty.",The location was fiNe~,,A clean apartment and honestly a few more things I'm just to frustrated to write about right now.,,[],[],[],[],[],[],null,339912446,Xhosoli,Nmumhad,https://a0.muscache.com/im/pictures/user/2eeaef13-434f-4623-b2a5-08d5076227cb.jpg?aki_policy=profile_x_medium,true,5e6587f2274e3df91c040cf4
627469989,2906082919,13874915,42519948,121166,2,2020-05-31,2020-06-02,HM2FAPMQKD,1,4,5,5,3,2,2,Not bad place. Thought it was a little bigger. Went in the middle of a riot but over all. It’s a pretty decent place,We called zencity and told about our issue and they told us they can’t do anything about it,null,,,,We was in the middle of the riot downtown in st. Louis tried to call and let some one know. Nobody even got back with me. We didn’t stay out second night and had to going somewhere else to sleep,,,,[],[],[],[],[],[],null,70559162,Mykiala,Allen,https://a0.muscache.com/im/pictures/user/81d99ec1-cee9-401f-98a6-dde80d8ef43d.jpg?aki_policy=profile_x_medium,false,5ed3c7249eab43277591f49e
610540497,2703284679,13310250,38645232,105786,2,2020-02-20,2020-02-24,HMJDJN98K8,1,5,1,5,5,5,5,"Unsafe practices; other people had access to my unit, belongings were moved and an item stolen. 

Stay at your own risk.",Your company utilizes unsafe business practices and seems to care very little about guest safety.,null,,,,,,,,[],[],[],[],[],[],null,57380707,Jon,Weiskopf,https://a0.muscache.com/im/pictures/user/46949f7c-56f5-4894-8871-c736d3a3e28e.jpg?aki_policy=profile_x_medium,true,5e4db5a1f8d880c538ba1f84
435869528,1232451640,10881455,32208083,89463,1,2019-04-09,2019-04-11,HMAJWCNAW9,2,5,5,4,4,5,5,"I did not have a good experience with Zencity. Upon my arrival to the apartment I found the back door facing the alleyway partially open and unlocked. Unable to figure out the locking mechanism I called for assistance. The call center could not help me. Between that and the extremely noisy neighbor I opted to stay elsewhere that night. 
They suggested different fixes throughout the day the next day, all of which I had tried, until their last suggestion was something new and actually worked to fix the door. 
My main concern was that Zencity never sent someone to check on the issue and seemed unable to do so even if they had wanted to. 
The inability to respond to guest issues and emergencies will be why I will most likely not stay with Zencity in the future.","The biggest issue with my stay was that I was unable to lock the back door my first night. The apartment was easily accessible from the back alley. The people I called were unable to help me resolve the issue so for my safety I was forced to spend the night elsewhere, spending an extra $500 at the only available hotel in the vicinity. Over the course of the next day they were able to find someone who knew how to operate the unusual lock. In the future please be sure to have your cleaning staff secure the door or leave instructions for guests on how to do so as the lock is not intuitive.",null,,,Responsive but not located in the area so unable too assist with any issues. Also did not know who to contact to give me assistance with issues.,,,,,[],[],[],[],[],[],null,117544740,Dalaney,Algiere,https://a0.muscache.com/im/pictures/user/fe3e7791-2a42-4d62-8c83-6ae29e3707fc.jpg?aki_policy=profile_x_medium,true,OH3o4TaOOm
607419303,2698390326,13302675,39027753,88952,2,2020-02-15,2020-02-17,HM43THK349,2,2,2,3,2,5,3,"The stay was a slight mess with a late check in due to the cleaning crew getting to the apartment the same time we arrived, we actually helped the cleaning crew clean an hour after leaving to give them time to clean,  the place had been smoked in by the guest prior to our stay, speaking to multiple ZenCity agents with little response using the AirBnB app, the WiFi was slow and information listed in regards to name of network were incorrect and the cleaning crew walking into the apartment while we were sleeping which was very alarming. The location was great for us and the actual property was clean. Everyone has off days and plans don’t always go as planned so we tried to be understanding. The cleaning crew did have their work cut out for them and they apologized. The stay started off rough but while there the bed was comfy and the kitchen was great.","The stay was a slight mess with a late check in due to the cleaning crew getting to the apartment the same time we arrived, we actually helped the cleaning crew clean an hour after leaving to give them time to clean,  the place had been smoked in by the guest prior to our stay, speaking to multiple ZenCity agents with little response using the AirBnB app, the WiFi was slow and information listed in regards to name of network were incorrect and the cleaning crew walking into the apartment while we were sleeping which was very alarming. The location was great for us and the actual property was clean. Everyone has off days and plans don’t always go as planned so we tried to be understanding. The cleaning crew did have their work cut out for them and they apologized. The stay started off rough but while there the bed was comfy and the kitchen was great.",null,,,,,,,,[],[],["Entire place"],"[""Incorrect information"", ""Host didn’t respond""]",[],["Slow responses"],"{""title"": ""Feedback"", ""highlightKey"": ""feedback"", ""localizedTags"": []}",76432666,Ashley,Guy,https://a0.muscache.com/im/pictures/user/6fee646e-26f9-4ff7-b830-05729b978a39.jpg?aki_policy=profile_x_medium,true,5e471ec3fb04acd3c58a503c
604274595,2614105691,13179852,38646097,105793,2,2020-02-02,2020-02-10,HM9ETBFTJW,2,2,4,3,3,5,5,"Appartement très bien situé, calme...MAIS attention à internet et l’eau chaude. 
Sur 8 jours internet n’a fonctionné qu’un seul jour et personne pour régler le problème !!!!!! Nous ne sommes pas des techniciens d’internet et ce n’est pas à nous de résoudre le problème !!
Par ailleurs, la veille de notre départ nous n’avions plus d’eau chaude et ce jusqu’au lendemain et encore une fois, personne pour résoudre le problème !!!
En revanche, ils savent envoyer des e-mails pour vous rappeler l’heure du départ !
Suis extrêmement déçue par la réactivité quant à la recherche de solution. Aucune solution nous a été apportée ou proposée !!!",Je dirai plutôt StressCity. Ils ne méritent absolument pas le Zencity Label !!!!!!,"""Sur 8 jours nous n\u2019avons eu qu\u2019une seule journ\u00e9e avec internet et tous les autres nous avons du utiliser notre propre r\u00e9seau ! Du coup, \u00e0 qui devons nous envoyer nos factures de surconsommation??? Zencity n\u2019a pas \u00e9t\u00e9 capable de r\u00e9soudre notre probl\u00e8me. En revanche, ils nous ont envoy\u00e9 des personnes pour checker l\u2019alarme incendie. De qui se moque-t-on ??? Personne n\u2019est venu pour r\u00e9soudre internet. De plus, la veille de notre d\u00e9part et jusqu\u2019au d\u00e9part, nous n\u2019avions plus d\u2019eau chaude et personne pour r\u00e9soudre le probl\u00e8me !!!! Aucun SAV.""",,,"Quand cela les concerne ils répondent vite et lorsque vous avez un problème, ils ne cherchent pas à le résoudre !!!",,,,,[],[],[],[],[],[],null,326609341,Nouara,Aftis,https://a0.muscache.com/im/pictures/user/a2ab1cb5-515a-4df2-ab40-bec7a5a66ffa.jpg?aki_policy=profile_x_medium,true,5e35fc9c2389f383e4a88b99
638500601,2997767802,14099562,34977420,95848,1,2020-07-13,2020-07-15,HMMMHHBZ4W,2,2,2,2,2,5,5,Tbh it really could have been better.,I’m sorry about the sheets. My period came unexpectedly and I didn’t know what to do. Otherwise cleaning walls needs done swept and mopped properly and the kitchen cabinets needed washed bad.,null,We arrived early which was on us but even waiting 2 hours and we were told that it would be ready at 3 pm they still hadn’t came in to clean anything.,The walls in the bedroom were dirty. The bathroom looked clean but the tub was gross and was stopped up so when you shower your standing in water. The floors need scrubbed and the cabinets were absolutely nasty on the outside. There were no pot holders there weren’t any knives to properly cut things.,I asked about early check in was ok we couldn’t but the for it to not be ready at check in time was ridiculous.,,,,,[],[],[],[],[],[],null,340247188,Maysa,McDowell,https://a0.muscache.com/im/pictures/user/1b5eab87-9e8a-485c-ad19-bb470c5e1eaa.jpg?aki_policy=profile_x_medium,false,5f0c7c5864bba9b8003ae205
706740163,3209455349,14583738,42102964,119523,3,2020-11-04,2020-11-05,HMSZN4MQRA,2,4,1,4,1,5,3,"The location was good but is it worth the hassle?  The keypad info was wrong and there was no fob in the room for access to the apartment and parking garage.  I had to find a place to park my car for the night because there was not a fob to get into the parking garage.  Even after contacting the host, no fob.",The keypad info was wrong and there was no fob.  I had to find a place to park my car for the night because there was not a fob to get into the parking garage.,null,,,,,,,,[],[],[],"[""Incorrect information"", ""Unclear instructions""]",[],"[""Host didn’t respond"", ""Slow responses""]","{""title"": ""Feedback"", ""highlightKey"": ""feedback"", ""localizedTags"": []}",335488287,Chris,Ford,https://a0.muscache.com/im/pictures/user/4a1bf905-958e-484b-9e3a-60815c297ddd.jpg?aki_policy=profile_x_medium,false,5f9f3be46e15db3742c1f18e
424006464,1171956506,10707349,27403446,79186,1,2019-03-13,2019-03-15,HMAFYMHHA3,2,4,4,3,1,5,5,The area was nice I had no problem with finding things to do but the host responded very slow or not at all.,,null,,There was just a lot of holes and cracks in the walls in the bedroom but everything else was fine,"I had an emergency that I had to attend to at home so I was going to leave a day early but they refused to give me any money back, they also never responded to me when I asked them why I couldn’t receive any money back being that I let her know the day before I was going to leave. I also messaged them letting them know I was leaving at about 6 and no one responded till 10 am the next day. I just feel like the communication should
Have been a little better and I should have been told why I couldn’t receive any money back but I didn’t even get that.",,,,,[],[],[],[],[],[],null,247892677,Danajah,Anderson,https://a0.muscache.com/im/pictures/user/10c356f2-6518-4017-bc2f-a68df1122da1.jpg?aki_policy=profile_x_medium,true,
423633241,1162241260,10680158,28513963,80764,1,2019-03-12,2019-03-14,HMAFFMRR4R,2,5,2,1,2,5,5,The apartment was very dirty and I had to do much of the cleaning myself. Overall the neighborhood was nice and the price was cheap.,"I feel that due to the condition of the house and the lack of cleanliness of the apartment, we should have the cleaning fee returned, as we did much of the cleaning ourselves. There were dirty washcloths in the bathtubs, stains and hair on the sheets and towels in the bedroom, the overall smell of the apartment was unsavory, the amount of crumbs and human nails that were found was appalling, and it seemed that the apartment hadn’t been cleaned in quite a while.",null,We were not informed of the construction that did not let us enter through the front doors and we could not find the side door access.,The sheets in the bedroom were stained and appeared unclean. There were used wash clothes in the bathroom. There were stains inside the cupboards and there was expired meat in the freezer. The living room was filthy with crumbs and dirt everywhere. Inside of the fouton there were crumbs and fingernails within the cracks as if it hadn’t been cleaned for quite a while. My friend and I bought many cleaning supplies and had to clean in order to feel comfortable staying in the place.,When we saw the construction we contacted the host to get further instruction to enter the building but we had to wait in our car for a long time because the host did not answer and we did not know how to access the building.,,,,,[],[],[],[],[],[],null,247452796,Grace,Laurenzi,https://a0.muscache.com/im/pictures/user/4bcfebef-6694-4ca1-b372-1a5b3e8e36b7.jpg?aki_policy=profile_x_medium,true,
627067457,2899390235,13854745,40483452,114341,3,2020-05-29,2020-05-31,HM5R8CKEFD,2,3,5,5,3,5,3,"Place had a cool view but the room itself had a weird smell the whole weekend, I messaged through the app about getting into the place and didn’t get a response back. Had to call which is fine. Hot water doesn’t last long. WiFi didn’t work. And there is no rooftop like it said in the description at the time of writing this review.","Place had a weird smell, WiFi didn’t work, there was no rooftop. Didn’t respond to me on the app.",null,,,,,,,,[],[],[],[],[],[],null,106937281,Aaron,Graham,https://a0.muscache.com/im/pictures/user/d44a87f4-7f05-40f0-9d35-0954ddb70bc3.jpg?aki_policy=profile_x_medium,false,5ecc3f2c0839973f0c856301
620786591,2805940701,13487564,39484982,109456,2,2020-03-18,2020-03-24,HMER84A2ZC,2,2,4,5,1,5,3,"The nest had a lock on it. I had to ask twice for the heater to be turned off before they finally unlocked it remotely. Someone unlocked and went into the apartment during the day (I’m assuming cleaning people) and when I addressed this with Zencity, I got no reply. I left a day early due to personal reasons and once again reached out to Zencity stating that the apartment needed extra clean due to my line of work as a nurse, I was leaving the apartment 30 hrs before check out, cleaned surfaces I touched often with hospital grade disinfectant, and still got not a single response. My plan had always been to stay with Zencity for the duration of my time in St. Louis but the lack of communication is a huge issue along with SOMEONE HAVING ACCESS TO MY APARTMENT WHILE IM IN IT!",I’m very upset with how this company has treated me these last few stays. I will no longer be staying with you.,null,,,Someone WALKED INTO MY APARTMENT when I addressed it with them no one responded.,,,,,[],[],[],["Difficult to find"],[],["Host didn’t respond"],"{""title"": ""Feedback"", ""highlightKey"": ""feedback"", ""localizedTags"": []}",327319890,Jennifer,Bowen,https://a0.muscache.com/im/pictures/user/a9c828e5-f419-483a-924d-306785e30f2c.jpg?aki_policy=profile_x_medium,false,5e7148f80da9126932d2aa88
