id,reservation_id,booking_id,listing_id,unit_id,geo_id,reservation_checkin,reservation_checkout,reservation_confirmation_code,overall_rating,accuracy_rating,checkin_rating,cleanliness_rating,communication_rating,location_rating,value_rating,comments,private_feedback,accuracy_comments,checkin_comments,cleanliness_comments,communication_comments,location_comments,improve_comments,value_comments,love_comments,accuracy_tags,appreciation_tags,cleanliness_tags,checkin_tags,essential_amenities_tags,communication_tags,review_highlight_tags,reviewer_id,first_name,last_name,profile_pic_url,sent_slack,job_id
672965074,3137613459,14422450,44495015,132393,2,2020-10-08,2020-10-11,HM438WEK5M,1,1,1,1,1,1,1,"DO NOT RENT FROM THIS COMPANY!

I hope this review will save EVERYONE from ever having to deal with what we endured on what was supposed to be a fun family getaway. I have NEVER taken the time to write a review, but this experience was so unbelievably awful, that I won’t waste the opportunity to help warn others about this terrible company. 

We purchased a unit that specifically  listed it had 3 queen beds to accommodate our family. Zen City posted a listing for a unit with exactly that in an area that was relatively close to the things we wanted to see and do in downtown St Louis, so we purchased the unit.

As soon as we get to the unit, we knew something was wrong. The first thing we noticed was that the place was absolutely filthy. Hair and dirt EVERYWHERE. So what does that hefty “cleaning fee” they charge go towards I wonder? Certainly not CLEANING THE UNIT.  So, right off the bat, that was disgusting. 

Next thing we noticed was that we didn’t have the 3 queen beds we were supposed to have. We got in late, but we contacted the host right away to tell them these things. They ended up trying to go into the listing and CHANGING THE LISTING, to the unit they had put us in! Luckily, we still had pictures of the original listing we purchased and our confirmation email showing everything we were supposed to have. 

This company repeatedly try to put the blame on us saying several times “Oh, I see how you could have been confused” and “Sorry, you must have overlooked and bought a different listing.” after we kept providing proof of what we originally purchased.

As you may have already guessed, this host refused make the situation right, hung up on us, and told us to go through AirBnB. So, we did! AirBnB immediately saw right through this deceitful company. They saw that they tried to update the listing AFTER we initially contacted them, as well as the lies they told through the messenger. We ended up receiving a FULL REFUND, and immediately got our belongings out of that nasty dump and went to a nearby hotel, where we were able to salvage the rest of our trip. 

Of course, this company will do anything other than accept responsibility and be accountable for their deceitful actions, so I’m sure we received a delusional review in response to this one (reminds me of a 12 year old child throwing a tantrum screaming “I know you are, but what am I?”). 

However, if this review can save ANYONE from having to deal with this God awful company, then taking the time to write this review will have been well worth it!

DO NOT RENT FROM THIS HOST!!!",Please stop messaging us through AirBnB messenger. You act like a little twelve year old who is so insecure that they feel like they have to have the last word. You lied. You got caught. Be an adult and own it.,"""This host deceivingly posted pictures of a different unit with different accommodations, only to get caught and try to deny it. AirBnB saw right through their lies and issued us a full refund. DO NOT RENT FROM THIS HOST!""",We were given a completely different unit than we purchased. DO NOT RENT FROM THIS HOST!,"This host will charge you a “cleaning fee” without even cleaning the place. Hair and dirt all over the bathroom, dirty floors, etc. Absolutely disgusting. DO NOT RENT FROM THIS HOST!","They do nothing but lie, even when they are caught red handed. Thankfully, AirBnB saw right through them and issued us a full refund. DO NOT RENT FROM THIS HOST!","Regardless of where the location is, this company is ran by horrible human beings. DO NOT RENT FROM THIS HOST!",,"After getting a FULL REFUND from AirBnB due to the outright lying and deception of Zen City, we found much better value at a hotel nearby that didn’t have hair and dirt al over the floor. DO NOT RENT FROM THIS HOST!",,[],[],[],[],[],[],null,84272600,Kera,Jeffers,https://a0.muscache.com/im/pictures/user/98a9eb74-edd7-4d1c-933d-6d319b218abe.jpg?aki_policy=profile_x_medium,false,5f7cf79328a132567cf061b0
669935197,3153055335,14463458,45579978,133266,2,2020-09-29,2020-10-01,HMB2MJ589F,1,1,5,2,1,2,4,"I would NOT recommend this apartment to anyone. I was looking for a modern cozy apartment, but this was anything but that. The apartment did NOT look like the pictures that were posted. It was outdated and misrepresented. According, to Zencity the place recently underwent a renovation which is why the pictures differ from actual apartment. However, the said “renovations” made the apartment look worse. The apartment was not clean to my satisfaction. The apartment window seals were dirty and the blinds were COVERED with dust! The toilet was broken (I have a video) and a light was blew out in the bathroom. The apartment is located in CWE (loved that) but they are doing construction. Construction workers wake you up at the crack of dawn (if you’re in to that kind of thing.. GO FOR IT). The people who represented Zencity were anything, but helpful. They were snippy and rude. You can see them argue with customers in the review comments under other postings. You can count on that they AREN’T going to do the right thing by their customers. All they can offer you are excuses and insincere apologies. Do not book with Zencity!",,"""If you are looking to rent here RUN!!!! A total catfish! This apartment looks NOTHING like the pictures, which the exception of the sheets on the bed. Next to the cleanliness, THIS WAS MY BIGGEST CONCERN. They lure you in with a modern look, but the apartment has anything but that. I\u2019m unable to upload pics of the actual apartment. When I notified Zencity of my concern they stated the apartment had recent renovations. I thought renovations where supposed to make spaces look better...not worse. HORRIBLE CUSTOMER SERVICE!!!!""",,"The apartment was not cleaned to my satisfaction. The window seals were dirty and the blinds were so dirty that they were gray instead of white. When I brought this up to Zencity, they did not see it as a concern and advised me that this was the apartment that I booked.",Zencity is RUDE and unapologetic. As you can see on other posts they like to argue with their customers and point the finger. No responsibility.,"Location is not horrible because it is in the CWE, but they are doing construction and you can here it every morning at the crack of dawn. If you are looking for a getaway to get rest...don’t stay here.",,The apartment looking as host presented in photos.,,[],[],[],[],[],[],null,233882712,Lex,Porter,https://a0.muscache.com/im/pictures/user/1eaacfe5-f7d2-47c3-8113-9ae0949a44f0.jpg?aki_policy=profile_x_medium,false,5f710dd576d5b8b99cbb354b
673955924,3068708509,14257560,42103944,119530,3,2020-08-22,2020-10-12,HMFXKRMMKN,2,4,5,3,1,5,4,"The 46 Penn units are luxurious and with a great location towards the Plaza , walking distance. 
It has a lot of amenities but I was only able to use the gym due to COVID-19 even though  all the amenities are open. 
They assign you a private parking so you don’t have to leave your car outside. 
I found the apartments are in a safe zone and the building has personnel checking out people that comes in.
At my arrival to the apartment, I noticed the COVID-19 cleaning protocol wasn’t employed. 
Under the couch there was a takeout sushi lid, the bathroom had hair residues in the cabinet and towel closet . I had to take care of the cleaning myself.
The apartments are great, the problem is the Zencity Co. as the hosting entity.
I had an accident at my unit and first it was a challenge to communicate with Zencity and when they did communicate, they tried to relocate me to a place that I previously told them was unsafe.  
Meanwhile they where handling the damages caused to the unit by the accident, I had to move for 2 weeks and pay for hotel stays while they were trying to get an available unit for me.  
They never got the safe unit I asked and stalled the process of finding one. 
Because my stay was time sensitive, I had to book another Airbnb. All because I wasn’t provided an alternate option or accommodation in a safe location by Zencity. 
Thus, I ended up having to pay for 2 Airbnbs and a hotel room at once because they didn’t provide a timeline on the repairs or even communicating what was being done. 
At one point, Airbnb had to become involved in the process. 
It has been one of the worst experiences I’ve had with an Airbnb host.",,null,,"In COVID-19 times there is a CDC  protocol on how to handle the cleaning. 
It wasn’t followed when I arrived to the apartment. At the moment I let them know and they apologize for it.","Zencity management is very difficult to reach.  
I had an accident at their apartment an I quickly notified them but they answered 3 days later when the emergency was already being dealt with. 
I consider that as an unprofessional behavior.",,,"If you a have little kids be sure to rent a 2 Bedroom apt from the same building which has a bathtub as well as shower. 
Having a bathtub with a shower in the property will increase the value of the apartment. 
Also for guests, it would be good to have a balcony with maybe 2 chairs and a little table to be able to admire the wonderful view you have towards the pool at night.",,[],[],[],[],[],[],null,147639467,Veronica,Solivan,https://a0.muscache.com/im/pictures/user/629f3be3-4e6c-4922-a3bb-23dcb02e1f6a.jpg?aki_policy=profile_x_medium,false,5f405383384701947dcebdf5
704655876,3187783729,14558378,45675710,121167,2,2020-10-24,2020-10-28,HMWT5DDJ2F,2,2,3,3,4,4,4,Something I Didn’t Expect,,null,,,,,,,,[],[],[],[],[],[],null,243910777,Asiah,Dennis,https://a0.muscache.com/im/pictures/user/aef700b9-c171-478d-b689-90121c80c2c0.jpg?aki_policy=profile_x_medium,false,5f944ec46e15dbaf82c04c53
663015374,3120669885,14380412,37081706,102014,1,2020-09-10,2020-09-11,HM3EEPCFE8,1,1,1,3,1,4,1,"This experience was very unfortunate. Working in hospitality myself, from start to finish I did not feel like my comfort as a customer was placed at the forefront. I waited in the pouring rain for a delayed response of the check in details. The next morning there was shattering glass at 6am right below our window due to the construction. There’s heavy road work AND construction happening right below the apartment that starts promptly at sunrise. The bathroom reeks of mold which is probably due to how old the building is. When I went to turn on the water, the entire handle fell off. The pipes were hissing and due to the handle literally falling off, it made it an incredibly difficult to just take a shower. Worse of all was Zencity’s delayed and seemingly unconcerned response, basically saying I should have manage working with a broken shower on my own. For the price that their charging per night, it seems well within reason to expect a working shower and to be at least treated with a grain of care. Truly a disappointing experience.","This experience was very unfortunate. Working in hospitality myself, from start to finish I did not feel like my comfort as a customer was placed at the forefront. I waited in the pouring rain after reaching out once I booked for check in details since it was passed 3pm. The response came in about 25-30 mins later which generally might not be in issue but as a traveler in the middle of a pandemic, it left me waiting, drenched in the rain. The next morning there was shattering glass at 6am right below our window due to the construction. Obviously not within your control but I do feel you should have a disclaimer to your guests that there’s heavy road work AND construction happening right below the apartment. The bathroom reeks of mold which is probably due to how old the building is. When I went to turn on the water,  the entire handle fell off. I did try to latch it back on to at least take a shower but the knob was too difficult for me to turn on my own, the pressure and temperature would fluctuate because I couldn’t get a good handle on it and the pipes were hissing the entire time. Regardless of anything, you charge your guests $180 to be their own plumbers? Worst of all, is the delayed and minimal response and effort to even being helpful or wanting to satisfy your customer. Instead you say that I should’ve managed, not having an easy accesible shower in the morning. I stand that as I guest, it is not unreasonable to expect a working shower and at the very least your response in the world of hospitality, should be that of wanting to accommodate. It begs the question, why name yourself se city if this is an experience your comfortable giving to your guests?",null,,,,,,,,["Amenities"],[],["Bathroom"],["Late host"],[],["Slow responses"],"{""title"": ""Feedback"", ""highlightKey"": ""feedback"", ""localizedTags"": []}",116885062,Maya,Luna,https://a0.muscache.com/im/pictures/user/601af947-28f1-407d-a288-6f72c6eec308.jpg?aki_policy=profile_x_medium,false,5f56b4c7b1e5a6b571f7288d
660334756,3088415018,14305911,38646942,105795,2,2020-09-03,2020-09-06,HMBJFFKNPY,1,3,1,1,1,1,1,"If safety, cleanliness and communication is important to you I wouldn’t suggest booking. Photos are deceiving. I left and canceled Not even knowing where I would go. But I knew I wasn’t going to stay there.","Please take the time to go to place and look around. Would you want your family Coming from out of town to stay here or experience ,bad communication or for place to not be ready at time stated on booking. I suggest serious upgrade s including entry and inform people to be careful in this area. Cleaning is so important especially during this COVID19 times and I m disappointed that this is Not top priority with your company.","""The photos in add don\u2019t show stains,dirty window and the bad area. Thank""",I asked for early check in since I was driving from out of town when i booked. Didn’t get a response so I assumed it was alright. I was told I couldn’t and place wouldn’t be ready at the time stated I could check in. They would notify me. They didn’t notify me at all,"I have photos of sofa  with stains,carpet, stains , walls need painting. Windows dirty. There is a wire going across the floor that is so dangerous. We we’re getting bit by bugs. Rust around shower in bathroom. In need of upgrade and  TLC.",Horrible at communicating. Question s asked at booking NOT answered. Even asked several times with no response.i was told they would notify me when place was ready. Sat out front for 1 1/2. No response,Area looks very unsafe. People around and going in and out of building  suspicious  looking. Dirty and not so neat looking surroundings.,,For the area and the looks of the place ( dirty furniture and carpet) price was a little high. I expected  better.,,"[""Listing description"", ""Photos""]",[],"[""Kitchen cleanliness"", ""Bedroom"", ""Common areas"", ""Entire place""]","[""Late host"", ""Host didn’t respond""]",[],["Slow responses"],"{""title"": ""Feedback"", ""highlightKey"": ""feedback"", ""localizedTags"": []}",42247956,T,Davis,https://a0.muscache.com/im/pictures/user/4f28ef8b-523c-4963-9bab-f421a18152dd.jpg?aki_policy=profile_x_medium,false,5f5029e28b1be764fc08f599
616391083,2798923684,13475207,39599097,103658,1,2020-03-07,2020-03-09,HM8ZK5D93R,1,1,3,2,1,2,1,"Horrible host, not worth the money for the smell, broken toilet and dirty sunken couch.",Don’t recommend zen city at all stay away.,null,,,Overlooked and ignored my questions.,,,,,[],[],[],[],[],[],null,223574080,Hadi,Delgado,https://a0.muscache.com/im/pictures/user/bcd40aca-ade1-4b67-b40f-4518a3bc1601.jpg?aki_policy=profile_x_medium,true,5e62e8f1c5125508a5bf7807
669933110,3151103931,14458264,34977420,95848,1,2020-09-29,2020-10-01,HMNT8BSDXS,2,4,5,2,5,5,3,"I wish I could say I enjoyed my stay. 
Let's start with the good: The location is awesome - Just a short uber or even walk from downtown, and there are bike rentals 2 mins away so I rented a bike and biked to the museums and around Chicago. There is also a great Thai place STEPS from the building.

Bed - The bed was quite comfy, like other reviewers say.

Price - Obviously this is a cheaper listing in the area, so that's nice.

Now for the bad....

First off, walking in to this airbnb is like walking into a pre-owned vehicle owned by a smoker... Maybe no one had recently smoked in there, but the whole place had a horrible smokey odor. Ironically there were TWO no smoking signs in the space... 

Second, there were multiple areas in the bathroom and kitchen that had not been cleaned for some time. Huge buildup of dust and dirt etc in the corners of the room, baseboards and cracks in the stove had food in them. These things made me question how well cleaned the rest of the space was.

Third, the tub / shower had very little water pressure and took a long time to get hot, and every time you shower the drain backs up after about 2 mins of running the water, so you have to stand with your feet in disgusting shower drain back flow while you try to clean yourself. 

Finally, the bedroom also had top sheet - Only a duvet. Since most of the time a duvet doesn't get washed every guest, this was an additional gross factor. 

Last, you should know that street cleaners and construction vehicles of various kinds might wake you up in the morning. This might be seasonal, but while I was there at about 7am every morning there was some kind of beeping construction or city vehicle that slowly drove by the building. Because the AC unit is in the window, it lets all the sound in. 

Oh and one more thing - Host says there is street parking in the listing. I attempted to park on the street and wound up with a $75 ticket. Clearly I missed a sign somewhere and so this is not the hosts fault, but I wouldn't stay here if you intend on having a car.",,null,,"There were multiple areas in the bathroom and kitchen that had not been cleaned for some time. Corners of the room, baseboards, cracks in the stove had food in them etc. These things made me question how well cleaned the rest of the space was. In addition, the tub / shower backed up after about 2 mins of running the water, meaning you had to stand with your feet in disgusting back flow while you showered. The bedroom also had no top sheet - Only a duvet. Since most of the time the duvet doesn't get washed every guest, this was an additional gross factor.",,,,"I couldn't enjoy my stay because the whole place smelt like cigarettes and felt dirty. The price was good, but it needed to be clean and smell decent.",,[],[],[],[],[],[],null,83866768,Ryan,Breitkreutz,https://a0.muscache.com/im/pictures/user/8c4c6090-35c8-49a4-b240-e0b0e9888d82.jpg?aki_policy=profile_x_medium,false,5f7114bb91c1ed5a7f808462
669134716,3118338630,14375398,38646984,105796,2,2020-09-24,2020-09-28,HMTFYCEBCZ,2,3,4,1,5,5,3,This place was not cleaned at all prior to me arriving. Floor was dirty and sticky. The entire place was dirty.,,null,,The entire place had not been cleaned. I had to sweep. There was hair everywhere and dirt.,,,,Had it been cleaned. There was a quiet time but the entire building was loud.,,[],[],[],[],[],[],null,361105852,Dawn,Hawkins,https://a0.muscache.com/im/pictures/user/d040a85f-436f-43b9-9864-3b0af5f28192.jpg?aki_policy=profile_x_medium,false,5f6bcdabdd7149bd67704395
667081096,3132641610,14410271,38646984,105796,2,2020-09-21,2020-09-22,HMRFQMHM2J,1,5,5,1,3,5,3,👍🏻,,null,,,,,,,,[],[],[],[],[],[],null,126035455,Rachel,Via,https://a0.muscache.com/im/pictures/user/4777a24a-e242-4c83-b561-e0187621632c.jpg?aki_policy=profile_x_medium,false,5f67d54add7149dce96fa84e
668104642,3133094636,14411044,39485091,109451,2,2020-09-21,2020-09-26,HMWQRNANR2,2,3,5,5,2,3,4,"Nice place, quiet and clean.  Poor rehab work and finishing, poor HVAc drainage contributing to organic growth, poor shower cleaning full of mildew and growth.  Light switches don't operate logically, different rooms operate switches from other rooms and so on, very poor electrical work.",,null,,,,,,,,[],[],[],[],[],[],null,360271128,Sean,McPeak,https://a0.muscache.com/im/pictures/user/450f1138-b14f-428a-9140-32b57053637f.jpg?aki_policy=profile_x_medium,false,5f689fb7dd7149428a6fbe91
700419721,3174645608,14533562,38647024,105806,2,2020-10-13,2020-10-14,HMFZD4WX55,2,1,5,3,5,3,3,Don’t stay here. It’s not like the pictures,Re evaluate the units door. It’s broken and anyone could have gotten into that elevator and up to the room levels and kicked it in.,"""In the inner city and there was so description of that. Photos looked much more modern and cleaner than the place was. The amenities listed were there, like a microwave and a fully loaded kitchen. We couldn\u2019t even make ramen noodles.""",,"Scuffed walls, broken door",,I feel like we should’ve been told that we would be more downtown. I almost got my purse stolen a block away.,,For it to be what I expected. More modern and secure. The door was wiggly because it was broken.,,"[""Listing description"", ""Photos"", ""Amenities""]",[],["Entire place"],[],[],[],"{""title"": ""Feedback"", ""highlightKey"": ""feedback"", ""localizedTags"": []}",243177810,Sarah,Waclo,https://a0.muscache.com/im/pictures/user/537fdd9d-d5b8-47d8-b807-ed62968bfdff.jpg?aki_policy=profile_x_medium,false,5f84e3212bd86271dab5e4ba
666812850,3129981730,14401884,39484982,109456,2,2020-09-18,2020-09-21,HMSW4DBNSA,2,3,5,3,2,5,3,"My girlfriend and I stayed here for her surprise birthday trip. The unit itself was everything  the description gave. One issue I noticed was that it was not throughly cleaned, but overlooked it. With it being a basement/ground level pedestrians walking pass the unit can look directly inside when the blinds are opened. The mattress also felt old and sunken in, in the middle. The major issue came the last night at approx 9:45-10:00 pm when we returned from dinner. My girlfriend being pregnant had to use the restroom as soon as we entered. While using the restroom she seen a mouse run across the laundry room floor and into the bedroom. I didn't believe her until it ran from the bedroom into a closet. We immediately went outside, attempted to call the host several times, and leave voicemails. No response!!! I then emailed them, which they replied pretty quick. I advised them of the situation and that we need to stay somewhere else for the final night. They were able to get us into another unit 3 floors up. Before that we had to take all belongings into and down the hallway, checking to make sure other mice didn't get inside our things. We finally got upstairs and I did another walk through. I noticed this unit wasn't throughly cleaned either. The light switch for the kitchen and tv outlet were wired together. So the kitchen light had to be on to watch tv. The washing machine was also broken, with a full drum of  stale water inside. I contacted the host the next day about being compensated something for having to move out so late with a pregnant girlfriend for the rodent issue, then to get upstairs to a unit with broke appliances and partially cleaned and still haven't heard anything back. The cleaning woman actually came in the checkout morning promptly at 11 am to clean both units. I told her the situation and she seemed nonchalant as of this happened before. Zencity did inbox and advise they would fix the issue with the washing machine. But that was it. When it came to  the rodent issue it was thanks for letting us know.  Im not sure if pest control came out or not I feel like the unit was cleaned for the next upcoming guest and that was it. The location was great, close to downtown! I definitely would not be staying here again though and would not be gking through Zencity. Good luck","If a customer call, call them back and don't refer to inboxing especially during emergency situations.",null,,,"Attempted to call, but no one called back",,,,,[],[],[],[],[],[],null,323679600,Markell,Christian,https://a0.muscache.com/im/pictures/user/3f0e76cd-6c64-4f18-b4ea-f3eb1523aa80.jpg?aki_policy=profile_x_medium,false,5f629f4cdd71491ab46ec996
