id,reservation_id,booking_id,listing_id,unit_id,geo_id,reservation_checkin,reservation_checkout,reservation_confirmation_code,overall_rating,accuracy_rating,checkin_rating,cleanliness_rating,communication_rating,location_rating,value_rating,comments,private_feedback,accuracy_comments,checkin_comments,cleanliness_comments,communication_comments,location_comments,improve_comments,value_comments,love_comments,accuracy_tags,appreciation_tags,cleanliness_tags,checkin_tags,essential_amenities_tags,communication_tags,review_highlight_tags,reviewer_id,first_name,last_name,profile_pic_url,sent_slack,job_id
631539043,2947318301,13977868,36693625,101076,1,2020-06-20,2020-06-22,HMD9XDDMAQ,1,1,5,1,1,5,1,"A THIS IS A SCAM !!! DONT STAY HERE!! It was VERY dirty. there was HAIR in the bathroom all over. Dirt, dust, and crumbs in the kitchen , on the floor , in kitchen chairs and more. The pillows were dirty. The microwave door was broken. The futon was broken, held up by pieces not meant for the futon and it was also very dirty. I sent a message and they offered to clean the space, but instead I asked for my some of my money back as this was not what I was not an accurate representation of what I was paying for. I took videos, which they asked for when they offered to clean, which should have been done according to a signed note on the wall. They never responded until check out asking me for a good review. Maybe 4 hrs later they sent me a message requesting $700 for damage for microwave, stained table that was stained when I arrived, and a broken drawer/tv set, which was destroyed in the picture they sent to me but it was not destroyed when I left.

This is a SCAM",,null,,,,,,"A THIS IS A SCAM !!! DONT STAY HERE!! It was VERY dirty. there was HAIR in the bathroom all over. Dirt, dust, and crumbs in the kitchen , on the floor , in kitchen chairs and more. The pillows were dirty. The microwave door was broken. The futon was broken, held up by pieces not meant for the futon and it was also very dirty. I sent a message and they offered to clean the space, but instead I asked for my some of my money back as this was not what I was not an accurate representation of what I was paying for. I took videos, which they asked for when they offered to clean, which should have been done according to a signed note on the wall. They never responded until check out asking me for a good review. Maybe 4 hrs later they sent me a message requesting $700 for damage for microwave, stained table that was stained when I arrived, and a broken drawer/tv set, which was destroyed in the picture they sent to me but it was not destroyed when I left.",,"[""Listing description"", ""Photos""]",[],"[""Bathroom"", ""Kitchen cleanliness"", ""Bedroom"", ""Common areas"", ""Entire place""]",[],[],"[""Host didn’t respond"", ""Slow responses""]","{""title"": ""Feedback"", ""highlightKey"": ""feedback"", ""localizedTags"": []}",187192574,Lee,Drakeford,https://a0.muscache.com/im/pictures/user/964b7529-3ae4-4d41-91ec-fce1f69c7296.jpg?aki_policy=profile_x_medium,false,5eed364b0922d448fbe03434
658523246,3091707893,14314225,43849238,118449,1,2020-08-28,2020-08-30,HMWCNPXWCT,1,1,2,1,3,5,1,"There were a  multitude of issues that weren't addressed. First and foremost, this place is advertised with AC but that is not the case. The unit in the living room is so tiny, it doesn't even cool off the living room and attached kitchen adequately. When I brought this up, I was told by Zencity that they would have maintenance come and install at least 1 AC unit, if not 2 in the two bedrooms. The way the place is set up, the bedrooms are down a hallway from the living area - there is no way in hell this tiny unit would be able to cool the bedrooms. The towel rack was broken. They said maintenance would also fix that. MAINTENANCE NEVER CAME. We slept on the floor of the living room because the bedrooms were so hot. Which caused me to have neck and back pain. It's one thing to have an issue; it's another to make promises and not deliver. They also said that there was a fan in the closet - there was no fan when we got home on Friday night. We found 2 blood stains on the rug and a used condom wrapper on the floor of one bedroom. We had issues checking in as there was no key to the building in the lockbox nor instructions on the alternate way of getting into the building. Also, after sleeping on the floor and picking up the comforter to clean up the space, it was filthy underneath. I don't think the floor has been vacuumed in some time which made me even more nervous because of covid. While they were timely in their responses to my concerns, none of them were actually fixed. Their solution was to let us leave on Saturday and get a small refund, not even 50% saying it didn't ""seem like a good match."" We were there for a funeral and did not have the time or the mental space to search for another place and move all of our things. This is the first time I've had a negative experience with Airbnb. I still love Airbnb but definitely not this place.","You need to get your stuff together. One problem after another, that you did not address. You made promises that were not kept. I'm very disappointed.","""There is a tiny AC unit in the living room that was so small and weak, it did not even cool the living room and attached kitchen adequately. The way the space is set up, the two bedrooms are down the hall from the living room - there is NO WAY even a high end AC unit would be able to get to them. When I called about it, I was told that maintenance would come and install at least 1 unit, if not 2 in each of the bedrooms. Maintenance never came. I was told via messenger that there was a fan in the closet that we could certainly use and when I returned, there was no fan either. Maintenance did not come on Friday when we checked in nor Saturday. I did not sleep well either night as we slept on the floor - and in fact, had neck and back pain.""","There was no key to the building front door in the lockbox. There were detailed instructions on getting the key to getting in the front door to actually getting inside the unit. But there was no key to the front door. I re-read the instructions a few times and finally called ZenCity. I was told the ""code"" to get into the building after waiting on hold and waiting in the heat outside. If their instructions were so detailed, why weren't they updated in the instructions? They later told me that the last tenant ""took the key."" I don't believe that for a minute.","We found a used condom wrapper on the floor of one of the bedrooms. Because the AC didn't work, we slept on the floor in the living room and when I picked up the comforter, it was filthy on the bottom which means it hadn't been vacuumed in some time. This of course, is a concern during the time of covid. We found 2 blood stains on the carpet in the living room, the towel rack in the bathroom fell off when we put a towel on it.",Communication was good and somewhat timely but it was all lies. They promised maintenance would come with 2 AC units and would fix the towel rack. That never happened. It's one thing to have issues which can happen; it's another to make promises and not deliver on said issues. It's completely unprofessional.,,,"If you advertise AC, then there should be adequate AC which there wasn't. Every host should be cleaning more than thoroughly with covid in the air. If there is a problem, fix it - they just made a bunch of empty promises. This was the worst Airbnb experience I've ever had. Truly disappointed. The ""solution"" they had was attempt to kick us out on Saturday before our departing day of Sunday, saying ""it wasn't a good fit."" We were there for a funeral - there was no time or energy to look for a new place and move all of our things in between going to the wake and funeral. How about you just deliver on what you promise? I believe we should get a 50% refund for the problems we had - Airbnb was not helpful either.",,[],[],[],[],[],[],null,7983202,Christine,Horshock,https://a0.muscache.com/im/pictures/user/fcc7aa2a-fb38-4d9a-86d7-2d258c67007e.jpg?aki_policy=profile_x_medium,false,5f483578d25bfa64418d42d9
657031597,3081673890,14291005,35845966,98984,1,2020-08-25,2020-08-27,HMRFCRRCTE,2,3,5,1,3,5,3,"This experience was incredibly disappointing and considering my last stay I do not know if I’ll be staying with Zencity again. I stayed with this host, same building but different unit, couple weeks back. I love the location, it’s near plenty of shops, and I love waking up being across the street from tennis courts. The host had the audacity to display signage boasting about the cleanliness of the room when it was nothing but. The restroom was full of urine and hair everywhere. The issue was so bad I sent the host 3 messages within an hour of my arrival with pictures.

There was an offer after receiving several automated messages in response to my email to have someone clean the problem areas and sweep the floors.  No one ever showed. The issue was so bad I used boiling water and the apartment cleaning products to disinfect the restroom. The young lady at concierge, who checked me in on my last visit, even reported the issue to a Zencity cleaner the following morning. 

This room did not meet the standards of cleanliness in the midst of Covid-19, there’s no way, and you all should be ashamed. If I could have cancelled this booking and received a full refund I would have. Extremely disappointed.","This experience was incredibly disappointing and considering my last stay I do not know if I’ll be staying with Zencity again. The audacity to display signage boasting about the cleanliness of the room when it was nothing but. 

This room did not meet the standards of cleanliness in the midst of Covid-19 and you all should be ashamed. If I could’ve cancelled this booking and received a full refund I would have. Extremely disappointed.",null,,"Upon my arrival I quickly reached out to the host, the apartment had not been cleaned. The toilet was full of urine and there was hair EVERYWHERE as if someone was shedding","I immediately reached out to the host about the hair everywhere, the lack of cleanliness, a piece of broken furniture, and a small hole in the wall. Initially all I received was automated emails about check in. When I finally got a proper response offering to have someone come clean I was in a tennis tournament. I responded with a proposed time for tomorrow and no one showed.",,,It’s a global pandemic at the least I expect the space to be clean,,[],[],[],[],[],[],null,115727400,Semaj,Miller,https://a0.muscache.com/im/pictures/user/d97a3818-e9cb-4958-bd2a-de67fba1f288.jpg?aki_policy=profile_x_medium,false,5f445120384701e8f9cf9416
654834111,3079774593,14286142,39588370,109943,1,2020-08-20,2020-08-22,HMP9CJSKZC,1,2,3,2,1,4,2,"The locks to the building and the apartment took forever to open due to outdated door locks. The WiFi didn’t work. It wasn’t Covid-19 ready. No hand sanitizer, face masks, or anything of that sort. The host didn't respond to any of my calls during my stay. It was a terrible experience!",,null,,The bathroom and bedrooms weren't that clean. There was only one garbage bag for the kitchen trash can.,"I've tried to reach out to the host several times, however, no one answered nor returned my missed phone calls. The wifi did not work at all. It was a struggle to get inside the building and inside the actual apartment because the locks are extremely old and require a lot of wiggling the keys.",The location was nice.,,"It would have been nice to utilize the Wifi.
It would have better if it was cleaner. There wasn't any hand sanitizer, face mask or anything to help keep us save during the Covid-19.",,[],[],[],[],[],[],null,312107374,Chvell,Cunigan,https://a0.muscache.com/im/pictures/user/22a6dbcf-29e1-4f7a-9796-f59ce44ecbe0.jpg?aki_policy=profile_x_medium,false,5f3c51cc47c0492852f569f7
673434796,3129939274,14401855,45204466,103660,1,2020-09-27,2020-10-11,HMF5JBDEZZ,2,3,5,5,3,5,3,"The good, bad and ugly!
Location is great, the apt is run down and not stocked up at all. Listing says quiet time after 10pm,and yes, there is a bar downstairs bit it's more of a club . Loud music banging the apt till 2am almost every night. Good luck sleeping",,"""Not bar downstairs, it's a club. Goes almost 7 nights till 2am. Good luck sleeping""",,,,,,,,[],[],[],[],[],[],null,13904914,Sohail,Hafesjee,https://a0.muscache.com/im/users/13904914/profile_pic/1396664021/original.jpg?aki_policy=profile_x_medium,false,5f6fc647dd71490f0e70d194
711149100,3234075332,14617682,45811011,135575,3,2020-11-22,2020-11-24,HMDREPDYDT,1,2,1,5,1,5,2,I would recommend to get every detail you can before renting from this company.,,null,,,,,,Parking is horrible and Zencity aren't good at communicating.,,[],[],[],[],[],[],null,338040751,Shannon,Burton,https://a0.muscache.com/im/pictures/user/77f76b50-5dbb-4a8e-9ead-e6ce6435a328.jpg?aki_policy=profile_x_medium,false,5fb99dc6783bf824855ab5a3
635512070,2974354297,14037068,43858701,122064,3,2020-07-03,2020-07-06,HMWAMNEYT3,1,4,5,3,3,5,1,Pending..,,"Follow up contact was less than desirable",,,,,,,,[],[],[],[],[],[],null,157216821,Michael,Shorty,https://a0.muscache.com/im/pictures/user/eb125cd3-ab32-460e-9e73-57056cf70cc5.jpg?aki_policy=profile_x_medium,false,5efe64320d978d64915721db
