id,reservation_id,booking_id,listing_id,unit_id,geo_id,reservation_checkin,reservation_checkout,reservation_confirmation_code,overall_rating,accuracy_rating,checkin_rating,cleanliness_rating,communication_rating,location_rating,value_rating,comments,private_feedback,accuracy_comments,checkin_comments,cleanliness_comments,communication_comments,location_comments,improve_comments,value_comments,love_comments,accuracy_tags,appreciation_tags,cleanliness_tags,checkin_tags,essential_amenities_tags,communication_tags,review_highlight_tags,reviewer_id,first_name,last_name,profile_pic_url,sent_slack,job_id
91424776,163319233,,9717268,,1,2016-08-01,2016-08-04,FZX4RZ,1,2,1,1,2,4,1,"My trip to Chicago with my girlfriend was amazing, no thanks to Chris's apartment. All the great reviews, made picking Chris's apartment an easy decision. However, my girlfriend and I experienced nothing but issues. We had difficulty checking in. There was confusion over which unit we were in and both units were dirty. We were never provided clean sheets or towels in the three nights we stayed at Chris's apartment. The sheets were covered in little hairs and smelled bad. The towels were damp and smelled worse than the sheets. The floors were dirty and half the light bulbs did not work. Chris stated he would provide a gift card to a local restaurant for the check in ordeal, but a gift card was never provided. After check out Chris stated he would issue a 50% refund for the awful hospitality, but the refund was never issued. Airbnb did take it upon themselves to issue a one night refund due to the check in issues we faced. Chris did not even call to express his apologies.  To future renters... bring your own towels and sheets.  ",,"The kitchen and bathroom did not match the pictures in the listing. Please let me know if pictures are needed to confirm.","Instructions provided for check in were inaccurate. Lock box combination provided did not open the lock box. When correct combination was provided, keys were not in the lock box. After calling several times and waiting over 30 minutes after our check in time, the keys were placed in the lock box by the people previously renting the apartment. Once we go to the room, the place was not cleaned. After speaking with Paul, Chris's assistance?, he indicated we were given instructions to the wrong apartment. Instructions stated 4th floor, but we were supposed to be on the 2nd. Regardless, both units were uncleaned upon arrival. ","Apartment was dirty. Cleaning team did not come until hours after our 3pm check in. Even after the cleaning team came, the sheets and towels were dirty. Bathroom and floors did not seem clean either.","Paul was extremely helpful and understanding of our ordeal, however, it seemed like Chris did not care. He indicated he would provide a local restaurant gift card to compensate for the issues we faced at check in. Gift card was not provided. After check out, Chris stated he would issue a 50% refund, refund was not provided. ",The location was great. Close to everything we wanted to do.,,"I had a terrible experience staying at Chris's apartment. Based on all the great reviews, I thought staying here was a no brainer. I was wrong. I had issues with checking in. Both units I was directed to were dirty. I was never provided clean towels or sheets. Several of the light bulbs were out, the refrigerator seemed to be dipping coolant, my white socks turned black within minutes of walking on the carpet, and the pictures of the kitchen and bathroom provided on the site did not match the unit I stayed in.  Chris assured me he would provide a gift card to a local restaurant for the issues faced at check in. Gift card was never provided. Chris then stated he would provide a 50% refund for the issues with my stay, another promise broken. To future renters of Chris's apartment, please bring your own towels and sheets to be safe. If you forget, there are plenty of nearby stores to buy some.",,[],[],[],[],[],[],null,70053367,Matthew,LaRosa,https://a0.muscache.com/im/pictures/user/357ca342-e117-4ea1-b577-edf185c9bc3f.jpg?aki_policy=profile_x_medium,true,
618137059,2813225934,13500342,27130424,78355,1,2020-03-09,2020-03-14,HMRFWAWDXW,1,1,1,1,1,3,1,"Poor service, poor communication, dirty towels, horrible customer service.",I think our experience warrants a discount and refund of partial funds for our stay. It was terrible!,null,Late. Not told the place was ready until we arrived to pick up keys. Then lied to and told the cleaner was in route the clean.  After waiting 20 minutes the cleaner had still not arrived.,Dirty towels and refrigerator.,,,,Following thru on the promises you make customers.,,[],[],[],[],[],[],null,79480348,Vershawn,Ward,https://a0.muscache.com/im/pictures/user/b17f4550-d4e9-474e-88ba-77b9e3e7a2f4.jpg?aki_policy=profile_x_medium,true,5e65abc088cd4d5834f7aa60
627129594,2892041189,13832047,36604022,101079,1,2020-05-21,2020-05-31,HMT8F8MAM2,2,2,5,1,3,5,1,When arriving to the apartment I noticed the floors were very sticky so I took it upon myself to sweep and mop. The mop water came out brown. There was also hair that was not mine in the bed. This was disappointing since I had messaged the host requesting an early check in but was told no because the place needed to be cleaned but I arrived to a not clean place. Other than that it wasn’t too bad.,,null,,,,,,,,[],[],[],[],[],[],null,245026919,Karyna,Maganzini,https://a0.muscache.com/im/pictures/user/855ae473-3d92-435c-b264-795dcf7b5d25.jpg?aki_policy=profile_x_medium,false,5ec5afd59eab436753908940
625136906,2882637045,13803439,36693625,101076,1,2020-05-14,2020-05-17,HMHKHDBXM9,2,4,5,1,5,5,2,"Apartment is in a good area, some issues with cleanliness. but other than that it was a nice weekend away",just clean better especially during a pandemic. nobody wants to walk in to a place that is supposed to be covid free and see hand prints and stains from previous guest.,null,,"had hand prints all on the walls, stains on every sheet they had and so of the curtains. Would’ve been a nice stay if it wasn’t so dirty",,,,It being clean.,,[],[],[],[],[],[],null,240486325,Mackenzie,Davis,https://a0.muscache.com/im/pictures/user/6bea45eb-622e-4f59-851e-9d6e75ce5386.jpg?aki_policy=profile_x_medium,false,5ebc7c9b417f8e4ae2173503
668706993,3131565173,14406755,43480452,127605,1,2020-09-20,2020-09-27,HMZ8SANCWT,1,5,5,4,1,5,1,There were multiple problems with the place and the host was either unresponsive or slow to respond.,,null,,Outdoor furniture,,,,,,[],[],[],[],[],[],null,111967011,Chris,Morris,https://a0.muscache.com/im/pictures/user/efea376c-3f24-4432-92f8-54ce20ff2bea.jpg?aki_policy=profile_x_medium,false,5f66877576d5b83224b9847f
613359193,2756396785,13408886,41719806,117858,3,2020-02-27,2020-03-01,HMMKXCH4PE,2,5,5,1,4,5,1,"Floor looks not cleaned for long long time, liquid spill markings in number of places over the laminated floor areas, white chalk like powder by the basebords, totally dirty all over the appartment, carpet in bedrooms not vaccumed, old spilled liquid residues in the fridge, glass or coffee cup rings on the countertop, old toothpaste markings on the bathroom sink area, dirty kitchen sink area, dirty utensils.","Not sure if I want to stay in any units by Zencity, bc of the ignorance.",null,,"Floor looks not cleaned for long long time, liquid spill markings in number of places over the laminated floor areas, white chalk like powder by the basebords, totally dirty all over the appartment, carpet in bedrooms not vaccumed, old spilled liquid residues in the fridge, glass or coffee cup rings on the countertop, old toothpaste markings on the bathroom sink area, dirty kitchen sink area, dirty utensils.","I wrote a message to the host describing in details all cleaning issues troughout the appartment, received response that are sorry that the ""cleaning crew missed few spots"".
The ""few spots"" is 1200 sq ft area....
I was asked to send pictures, which I did, but never received response.",,,"Clean place.
Owner had a chance to send a cleaning crew and offer to clean it. Never offered to do so.",,[],[],[],[],[],[],null,338180991,Christopher,Matysek,https://a0.muscache.com/im/pictures/user/e48eb5c6-a11a-4b97-b381-fe92169837ea.jpg?aki_policy=profile_x_medium,true,
624310809,2875566753,13773146,42102965,119524,3,2020-05-06,2020-05-09,HM4T2XCRR2,1,1,1,1,1,1,1,Good luck we paid for a 3 night stay and were given wrong code to smartlock so couldn't even get in and had to find another place to stay at the last minute.,When someone pays to stay in your units and they never even get in the door because the smartlock code doesn't work is beyond unacceptable especially when it costs even more money to find a different place to stay last minute since your host never resolved issue to get us into the rental.  Not to mention still haven't received response to getting refund  or even an apology.,"The code for smartlock was incorrect.",Never even got access to the rental since the code for smartlock didn't work and never got help to rectify the situation from host. Paid for a 3 night stay we were never able to use.,,,,,Being able to actually use and access the rented unit.,,[],[],[],[],[],[],null,269858018,Shirley,Ferry,https://a0.muscache.com/im/pictures/user/5fc99a11-2201-4a24-9cce-50cae78afacb.jpg?aki_policy=profile_x_medium,false,5eb1e22f083997fd65832b25
709780708,3222968149,14600649,22265007,59296,1,2020-11-15,2020-11-18,HM2PBZWE58,2,1,5,1,1,5,3,Super annoying .. if we put Music in that tv she was text me 3 min later ..... we can’t even Watch a movie in peace ... .... that place is nice just not clean we had to clean myself to feel Good .....,,null,,,,,,,,["Photos"],[],["Entire place"],[],[],[],"{""title"": ""Feedback"", ""highlightKey"": ""feedback"", ""localizedTags"": []}",85611124,Margarito,Rodriguez,https://a0.muscache.com/im/pictures/user/b56c33a6-7e88-4bba-8529-203bc8d950ac.jpg?aki_policy=profile_x_medium,false,5fb08a95ee3e374f815e0f6e
623266665,2864601663,13732075,42034984,118897,3,2020-04-26,2020-05-01,HMWEY3D5YD,1,1,1,1,1,1,1,"I did not actually go to the property but they took my money for the whole stay. Very dishonest company, who choose to not respond to emails on their site. I would be very careful when booking with them. I have a lot of Airbnb travel experience and this was the most dishonest one I have ever experienced.","This has been the worst and most dishonest experience on Airbnb ever. I booked nd they repsonded ""will let you know within 24 hours"". Since I needed the place that same night I cancelled. They charged my card for the whole 4 day stay which included cleaning. I did contact airbnb to resolve but Zencity said they had a very strict refund policy. I got nothing for my $254. They simply took all of my money for the whole 4 day stay. Cleaning fees and airbnb fees. Tax's etc., A reputable company would never behave like this. BE VERY CAREFUL when handing over your credit card to this dishonest company.","They charged me for a booking I cancelled. Very dishonest company",I emailed them on their website to cancel and they never responded,They charged me for a cleaning fee and I never used the place,They never responded to my communication. They took my money for the whole stay. Beware of this company.,I did not go to the home at all.,,This is my VERY WORST Airbnb experience ever. They took all of my money after I tried to cancel. Be very careful when giving this company your money.,,[],[],[],[],[],[],null,1464196,Jurdy,Dugdale,https://a0.muscache.com/im/users/1464196/profile_pic/1421379732/original.jpg?aki_policy=profile_x_medium,false,5ea0b7149eab43b09b8e15f4
708207512,3216706223,14592276,43481232,127602,1,2020-11-08,2020-11-11,HMD9YWTJ2K,2,5,5,5,1,5,5,Make sure your music is not to loud they will change the door code while your things are still inside,,null,,,,,,,,[],[],[],[],[],[],null,297739367,DaShawn,Grant,https://a0.muscache.com/im/pictures/user/da300737-645f-4f56-a6ce-44696e775fc1.jpg?aki_policy=profile_x_medium,false,5fa7484f28a1323e52f6b0b4
640605471,2982886195,14059209,39027757,90553,2,2020-07-18,2020-07-20,HMCC42ZSKM,1,1,1,1,1,1,1,"The issues began when we arrived and the checkin information was not only incorrect, but the key to our apartment was missing. As per our previous correspondence there were several issues with cleanliness when we arrived. The TV and internet also did not work.","Hello, I am writing to request a 50% refund for my stay with you from Saturday the 18th to Monday the 20th. The issues began when we arrived and the checkin information was not only incorrect, but the key to our apartment was missing. As per our previous correspondence there were several issues with cleanliness when we arrived. The TV and internet also did not work which I assume was because there was no Eero in our apartment. I would be happy to further discuss these issues and provide more photos if necessary.",null,,,,,,,,[],[],[],[],[],[],null,327162968,Cara,Bray,https://a0.muscache.com/im/pictures/user/c045f79c-0e21-496d-a125-550dad346a52.jpg?aki_policy=profile_x_medium,false,5f12217e0db1e136ced2d871
620048275,2832943686,13559049,39485040,109440,2,2020-03-18,2020-03-20,HMXNQNQNE9,2,3,2,5,1,5,5,"Great location and stylish loft. Host was the disappointment, I had several issues no key fob to enter building after a certain time, a leak in the bedroom, etc and the host stopped responding to me.",Your location was beautiful and well styled. I was very disappointed in the communication with whomever was hosting they just didn’t care about my needs,"""There was no key fob which prevented me from leaving my air bnb after 5. I came to visit family and this severely impacted my time to connect. Also, there was a leak in my room over the bed since it was raining. I reached out to the host and they stop responding to me.""",,,,,,,,[],[],[],["Host didn’t respond"],[],[],"{""title"": ""Compliments"", ""highlightKey"": ""compliments"", ""localizedTags"": []}",104383387,Jonica,Burkhead,https://a0.muscache.com/im/pictures/user/bcaa9be7-ce6e-4232-9667-c978d31029d0.jpg?aki_policy=profile_x_medium,true,5e714877838827770c90ce5d
636931536,2977034102,14044191,40483452,114341,3,2020-07-09,2020-07-11,HMAR3J2DQB,2,3,2,1,3,5,1,"Looked better online than in person. Before we even entered the building we had issues with parking. The directions from the company left out important details. The garage they instructed us to use was only open certain hours and when we arrived it was closed. There was an alternative entrance to the garage that we had found out about later, after we talked to someone who lived in the building. First thing we noticed when we walked in to the apartment was the smell of trash that did not go away our whole stay. The smell lingered throughout the whole apartment. Even after spraying a room refresher the smell did not go away. 

Second when we put our things down we saw what looked like pizza sauce on the table and we found a parking ticket from the previous month. Which iwas the first indication of the place not being cleaned prior to our arrival. Next while checking the beds for bedbugs we notice there were crumbs and hair on the sheets which means the sheets were not washed. Then we noticed the floors and rugs throughout the apartment also looked like they haven't been vacuumed in awhile. There were other minor indicators of the place not being cleaned but these were the main ones. They pride themselves on keeping the property upto hotel standards but it was far from that. 

To top it off, after all of that, we couldn't even watch TV because it said too many people were using the account. They don't have regular TV they have Roku TV and I assume they use the same account for other rentals. 

Personal notes: 
We found the beds were way too stiff for our liking. We preferred sleeping on the couch. 

The curtains kept no light out so don't expect to sleep in. 

We noticed a monitoring device under the island. To us it was not that big of a deal but it would have been nice to know about.

We were really looking forward to this place and saw all the great reviews, but I unfortunately we were extremely disappointed and would not recommend.","The review we'll be leaving

Looked better online than in person. Before we even entered the building we had issues with parking. The directions from the company left out important details. The garage they instructed us to use was only open certain hours and when we arrived it was closed. There was an alternative entrance to the garage that we had found out about later, after we talked to someone who lived in the building. First thing we noticed when we walked in to the apartment was the smell of trash that did not go away our whole stay. The smell lingered throughout the whole apartment. Even after spraying a room refresher the smell did not go away. 

Second when we put our things down we saw what looked like pizza sauce on the table and we found a parking ticket from the previous month. Which iwas the first indication of the place not being cleaned prior to our arrival. Next while checking the beds for bedbugs we notice there were crumbs and hair on the sheets which means the sheets were not washed. Then we noticed the floors and rugs throughout the apartment also looked like they haven't been vacuumed in awhile. There were other minor indicators of the place not being cleaned but these were the main ones. They pride themselves on keeping the property upto hotel standards but it was far from that. 

To top it off, after all of that, we couldn't even watch TV because it said too many people were using the account. They don't have regular TV they have Roku TV and I assume they use the same account for other rentals. 

Personal notes: 
We found the beds were way too stiff for our liking. We preferred sleeping on the couch. 

The curtains kept no light out so don't expect to sleep in. 

We noticed a monitoring device under the island. To us it was not that big of a deal but it would have been nice to know about.

We were really looking forward to this place and saw all the great reviews, but I unfortunately we were extremely disappointed and would not recommend.","Parking",,,,,,,,[],[],[],[],[],[],null,237072544,Nick,Ballard,https://a0.muscache.com/im/pictures/user/9e1126ba-c357-4fec-967b-9a95db12135c.jpg?aki_policy=profile_x_medium,false,5f0507ade1955a3b14a2c186
627334983,2872593643,13762162,39485012,109462,2,2020-05-08,2020-06-01,HM4JMMWZES,1,5,5,4,1,5,2,Terrible stay.,,null,,,,,,,,[],[],[],[],[],[],null,343231858,Jeff,Thomas,https://a0.muscache.com/im/pictures/user/7e72bb39-c68b-4a08-825d-80b3293987f9.jpg?aki_policy=profile_x_medium,false,5eb570e9083997824b835beb
626137343,2894717360,13839801,42814222,122066,3,2020-05-23,2020-05-25,HM995ANNRB,2,5,5,1,5,5,5,Cute place! Quiet! Safe feeling.,,null,,"Upon arriving we walked in to sticky floors, super greasy  counters and kitchen sink, a water logged French press , spilling into the kitchen cabinet and down on the counters. There was also make-up in the sheets, and poop in the toilet. 🙁. We mopped the floors, cleaned the counter changed the sheets, cleaned the toilet.  As we were getting ready to leave, we went to load the dishwasher and when we opened  it there was a piece of watermelon and a blob of soggy bread. We have pictures of everything. We won’t write this  in the public section. We don’t want to trash your rep and want your business to succeed. Hopefully there is motivation to get it right for the next client. Oh and spatulas and wine opener in the drawer had some kind of tomato sauce on it. 
The place is real cute, quiet, safe feeling and has great value, if clean.",,,,,,[],[],[],[],[],[],null,112012368,Lauri,Lane,https://a0.muscache.com/im/pictures/user/37b71497-4dc1-496e-a247-db85e464f54b.jpg?aki_policy=profile_x_medium,false,5ec849179eab435c5f90d429
644310046,3023294484,14163930,39149885,92108,2,2020-07-26,2020-07-30,HMXNAYRM2J,2,2,2,5,3,4,4,X,,null,Terrible check in. No doorman . . . Had to call maintenance (person in Chicago) didn’t respond for more than one hour.  Had to wait for pseudo doorman to unlock main door.,,,,,"Also, when I requested an extra day no one communicated the code  had changed.  Seems like amateurs in action.  No apologies or refunds from anyone.",,[],[],[],[],[],[],null,150331346,Denise,Andrade,https://a0.muscache.com/im/pictures/user/4b687186-5701-42fd-bdaa-e162b2e05206.jpg?aki_policy=profile_x_medium,false,5f1ca9899e684e29848ebc8b
649579499,3048674782,14217556,39588370,109943,1,2020-08-08,2020-08-10,HMYT4HYW4K,1,1,1,1,1,5,1,Zen city charged me twice for my stay and did not refund me my money. The communication was horrible. I was never able to talk to a manager. Horrible experience but never again will I patronize this company. They are criminals 😩,Zen city charged me twice for my stay and did not refund me my money. The communication was horrible. I was never able to talk to a manager. Horrible experience but never again will I patronize this company. They are criminals 😩,null,,,,,,,,[],[],[],[],[],[],null,266852931,Pauline,Steele,https://a0.muscache.com/im/pictures/user/49db6a7f-7b46-408d-bc63-ed19cd3949c0.jpg?aki_policy=profile_x_medium,false,5f2ca18418cc453ce92c4b63
646349974,3027414541,14173534,26423555,77290,1,2020-07-30,2020-08-03,HMN24RHFMZ,2,5,5,1,4,5,3,"Good location, decent value, decent amenities, but it just was not very clean.",You need a new cleaning company.,null,,"Nothing looked like it had been cleaned. Like moldings had dirt on them, floor didnt look swept, and there what looked like to be black mold on the ceiling where the shower was. I could be wrong, but it looked like it was.",,,,,,[],[],[],[],[],[],null,53483815,Matthew,Yakimchick,https://a0.muscache.com/im/pictures/user/6f22d388-fdb8-41be-82e0-ef53fb1fb8f9.jpg?aki_policy=profile_x_medium,false,5f21f74018cc45e0242a602d
628942484,2921357133,13918661,38647176,105807,2,2020-06-08,2020-06-11,HMEMH53RFW,2,3,4,3,2,2,3,Overall the places and value of this company are great but the people skills we ran into were well below average. Sneaky practices and bad support teams locally.,First place was amazing. The second was going well and then the lady ruined it.,null,,Kitchen and bathroom disarray,,,,,,[],[],[],[],[],[],null,345499387,Patti,Wideman,https://a0.muscache.com/im/pictures/user/daeb9984-d5ab-4d0b-8e12-3e2f81e76726.jpg?aki_policy=profile_x_medium,false,5edd5e925b36ef1ca75bdd56
705951268,3194282538,14567058,44344199,131951,1,2020-10-26,2020-11-01,HM3R4YJP5W,2,5,5,5,3,5,2,"The bones of this apartment were nice. It has comfortable furniture, was clean, had nice amenities in the kitchen and bathroom and had an awesome location. Unfortunately, I am quite disappointed in the management during my stay. After the first night, I reported an issue with the heater making excessive noise. The responded that they would send someone to check it out. Later in the week, nobody had come to check it yet and it stopped heating all together. I informed the manager again via message and phone call and he said that he would send someone that day to check it but again nobody came, so I had to spend two nights without heat. I will definitely avoid renting from Zencity again.",,null,,,"It took the host several hours to respond to questions. Also, I communicated an issue with the heater and was told twice that they would send someone to come check it out but never received follow up.",,,I spent two nights without heat.,,[],[],[],[],[],[],null,11767327,Natasha,Ackerman,https://a0.muscache.com/im/pictures/user/cd139849-9519-4c21-9d2b-1e899ed5c8ef.jpg?aki_policy=profile_x_medium,false,5f94b55e51a9a663c22572df
