id,concat_comments
750351756,Where do I begin   I guess by saying PLEASE DO NOT STAY HERE  SPEND YOUR MONEY ELSEWHERE    Ive never has a worser experience with a stay in my life  In a nutshell     There were NO lightbulbs in the bedside lamps so I had to use the closet light for lighting in the living room  They told me they would send maintenance the next day  so I stayed in my room the entire next day waiting and they never came    The microwave AND stove BOTH DID NOT WORK  so I was unable to cook    There was LOUD construction pretty much all day   am  pm   except on Saturday and Sunday  The noise was head pounding and woke me up everyday  I was also unable to use the room as a quiet place to study     WORST COMMUNICATION EVER  If you want them to answer the phone be prepared to wait  and also pray that they actually answer and not just hang up on you after a while  The messaging was a bit faster  but they did a good job of not responding to what I was asking of them  Some instances they would completely not respond at all  or say they would get back to me and I would never hear from them again  It was very aggravating working with them    I complained about all these things and do you know what all they actually resolved  ABSOLUTELY NOTHING  They couldnt even compensate me for the things that didnt work  On the  rd day I actually reached out and said I would like to cancel to receive the     refund for the days that I stayed and they didnt even get back to me  so I felt like I had to stay so it wasnt just a gigantic waste of money   I still cannot believe this place would allow themselves to provide this poor of a service to guests smh  Please do not stay here  you will regret it  Will never be booking with you all again  You all should take a great deal of more pride in the business that youre offering to people  I was overcharged for what I went through and no one helped  Ive also told people to never book here and will continue to do so  Non working amenities  no light bulbs in the displayed bedside lamps  and the  view  was just a window with another building completely in front of it  They did not send my instructions prior to check in  This made moving in a long  drawn out  and a hassle  WORST COMMUNICATION EVER  If you want them to answer the phone be prepared to wait  and also pray that they actually answer and not just hang up on you after a while  The messaging was a bit faster  but they did a good job of not responding to what I was asking of them  Some instances they would completely not respond at all  or say they would get back to me and I would never hear from them again Other than the fake view  I liked the location overall Construction in the neighboring units all day everyday  the view was not quite the  view  and very important things in the room were not working nor were they fixed 
750973765,This was my worst Airbnb experience to date and Im furious with this company    Im in St Louis visiting family but was looking for an airbnb for two nights because I had a major presentation for work and wifi was spotty where I was staying  So I reached out to Zencity before booking to ensure that wifi could reliably support zoom calls  I was assured the average wifi speed at the unit was    MPBS  So I went ahead and booked  As soon as I checked in  I tested the wifi  which hovered between   MBPs and   MBPS  never even reaching above  MBPs  I immediately reached out to Zencicty via Airbnb  told them the situation  and underscored how I needed this fixed urgently  When they hadnt responded in several hours  I found the Zencity website and found a contact email  I sent that address an email and it immediately bounced back    the email address was no longer valid  They were not contcatable    I ended up leaving the unit and taking my dispute to Airbnb  Believe it or not  in the dispute with Airbnb  Zencity has refused to give me any of my money back  I still have not heard back from my original message  which included screenshots of the abysmal wifi speed     The rates are low for a reason  avoid this scammy company  Get your act together   this is no way to run a company I specifically asked about wifi before booking  I was booking this spot because I  NEEDED wifi for a very important meeting  and where I was staying didnt have wifi  I was told wifi would be   MPs  In reality it hovered between     MBPs  I tested the wifi right when I checked in  reached out to ask for help and never heard back   I also reachedd out via the contact email address on Zencitys website  The email address was defunct and my email bounced back  Then  in disputes with Airbnb  Zencity declined to give us any kind of refund  Long story short  this company is a fraud with no care for customer service  Hair on rug I  never  heard from Zencity after reporting the wifi issues  I also reached out via their contact email address on their website  The address was defunct and the email bounced back  I ultimately had to turn to Airbnb 
751291393,great people you guys usually do a good job I dont knowcwhat happened the last   spots no coffee couldnt even change the heater it was cold and no response which was surprising cause Ive stayed with them
751629051,When I arrived at the location I followed the building entry instructions  to the letter literally speaking the codes out loud as told to do in the booking details  However  the doors would not unlock  Much to my surprise  there was another couple who had booked a Zencity listing on Airbnb who also could not get in    We had to wait in the entry until a tenant let us in the building as they exited  Now  even though we were now in the foyer of the building  we could not use the elevator as the access code at the door activated the sensor allowing us to go to our floor  but since the access code at the door didnt work  we could not get the elevators to function without a key fob  We had been told that the key fob was waiting for us upstairs so this would not be an issue moving forward  We tried calling Zencity from the phone number listed but couldnt get through  After    minutes of waiting  still unable to reach them a family arrived and graciously allowed us to ride up in the elevator to our floor  At that point another couple joined us who also was struggling with Zencity their code for the door did not work either   When we all got off at the same floor  we went to our rooms  only to discover that the key fobs were not in any of our apartments  I was finally able to reach them on the phone  but was told that the fobs had been lost previously and there was no way for us to get a new one  When I explained that that made it nearly impossible for us to enter or get upstairs due to our access codes not working  the woman on the phone insisted that the codes did in fact work  I kept her on the phone  went back downstairs  and with her still listening to me out loud tried all three codes  Not a single code for any of the rooms rented worked  I once again found myself locked out of the building unable to use the elevator  I had to wait for someone else to let me in and take me upstairs  Promptly at      p m  California time  where theyre located  the woman hung up on me despite the fact that we were still having a conversation  When I tried to call back at      PST  the phone rang and rang and rang  I attempted calling five times  They never picked up   At that point no one had responded to my pleas for support over the Airbnb messaging platform  Given that I was in town for work  and would be leaving the building frequently  the inability to safely access and use any of the entries made it such that it was impossible for me to stay  Before the woman unceremoniously hung up on me  I had requested to speak to management to get my money back because I would be checking out she informed me that was not possible    I had to go through Airbnb  who were incredibly helpful and handled the situation beautifully  in order to cancel the room and get my money back    By the time I had booked a new place and checked in  Zencity finally responded to my messages on the Airbnb platform  Reiterating they could not refund me and that they had called for maintenance to see if they could let me in the building  Their service is the worst I have ever experienced booking through Airbnb   I wish I could say I was exaggerating  but it is simply a terrible company to deal with  they say misery loves company  but there was nothing gratifying about knowing that four other individuals were dealing with the same issues  We all spoke with one another and confirmed that none of us were able to get help from them  and none of us received working access codes or fobs    If you are considering booking at this building  do not and I mean do not choose a Zencity listing  The building itself was lovely and all its tenants exceedingly helpful  but Zencity made it impossible to safely stay at the location 
462251541890733542,The location is amazing and the apartment was very clean   I would not recommend if you plan on making use of the kitchen as it was extremely limited with what is available  it shows that this was never a lived in apartment and is strictly for rentals   Communication was also an issue for us  we felt that the communication issue in having to reach out to obtain check in instructions despite being told we would be sent them  coupled with the lack of notice about maintenance on the building shutting off the water   was a real detriment to our stay     We also feel that there is a lack of basic necessities in the apartment in regards to the kitchen   i e  no pot holders   no salt or pepper shakers
752466443,Weird smell no parking This place had a weird smell and holes in some walls  Needed to be clean bad     
752278410,Pictures do not match  the place  Was very unclean and we ended up canceling our reservation  The whole apartment was dirty  Dig said it hadn t been clean since      and it showed  Yellow stains in towels and sheets  Holes and markings on walls throughout Bathroom fixtures and flooring were dirty  Window shades in the first bedroom were broken  and a chair had a white stain on it  Overall we did not feel comfortable  I have many pictures I can share upon request  Pictures from the listing did not match what the actual apartment looked like  Parking was very confusing Dirty throughout the apartment  Holes and marking all over walls  Yellow marks on towels and bed sheets  Spider webs in corners  Card in apartment said it hadn t been clean since       two whole months  Dirty floors especially in bathroom  Shower walls and shower has were filthy  I took pictures so they ar available upon request  Late responses
751229697,We stayed   nights  We were told there would be a key fob once we got initial entry  Well there wasnt a fob and there was no access to laundry facility or anything else  Very disappointed  Wont use again  stuck outside for over    minutes Being stuck at front entrance multiple times with it being between    to over    minutes was very irritating  no access to laundry facilities also frustrating  Dont feel you advertise correctly with washer dryer mentioned in headline but there isnt   in apartment   with no key fob I didnt have access to other floors  So what was supposed to be a relaxing little weekend get away turned out to be   frustration after another  Very disappointed  
751946101,Arrive early enough that theres someone to help when you cant get in because of a bad code for the door or keyholder  Prepare to brush your teeth in the kitchen sink  Please check your own codes to make sure they work  Check in was the worst experience Ive ever had  And there is NO sink in the bathroom  Had to use kitchen sink and they did put a mirror over it but just not usable  I had to call twice as neither the door code would work  someone from the building saw me struggling with it and let me in when I explained  then the key code would not release the door to get the key  I did call host again and got a really nice lady who worked with me to get the key to get in  it was cold and rainy and was standing outside in it trying to resolve the issue  no sink in the bathroom 
753332546,hidden camera s in bathroom
751499635,We were trapped in our room  The key wasn t there to get into the building and the intercom to get into the building was broken  They gave us a refund but we were trapped in the room all evening and night  The only way to get into the building and elevator was to ask a resident of the apartment building to let us in  There was no one near enough to bring us a key  This place is a corporation and didn t have any way to accommodate us  The workers we talked to on the phone were nice but took    minutes to answer every time and couldn t help us 
563836979108308594,Wasn t pleased with the stay   I was Looking for a place with free parking   a kitchen in a good location  Although it had all three   when we first arrived the person said he was new   didn know what to do when it came to the zencity apartments  His manager was in a meeting   he was waiting on her to call back  Then they couldn t find the key  Finally found the key   Got in the apartment   it was just not what i expected   There was stains on the counters   handles on the cabinets  Also smeared glass   microwave  The inside of the of the sink drain was yellow   Like bad rusted   Immediately I sent The owner pictures because we was writing each other back   forth because of the issue with the key   suddenly he stop writing me   I had To go out   get clean supplies   other stuff to make myself a little comfortable  The owner responded   hours later   The place wasn t that much so i guess You get what you pay for   Wouldn t stay again As i told You before the house wasn t clean   For it to be Covid going on you would think the place would be clean   sanitized 
752428271,We Were unable to enter property via intercom  there was no access fob in location  While likely just taken by last guest unintentionally  there was no communication or resolution  We had another stranger let us in the building hours later to collect our bags and ended up paying for a hotel  Cute place though  When we had to be let in and searched the entire place for the fob it started as funny and expected  With    hours and no resolution ever offered I had to get a hotel just so we could have someplace to stay we didn t need to rely on a stranger letting us in the building  Unable to use intercom to access  no fob for access in room after another person let me in  It took    hours for them to respond and I ended up paying for a hotel
754357083,Location and size is great but be prepared for a dirty apartment  Even after cleaners came back  it was still filthy  Hair and dirt all over the floor  a small blood stain on a comforter  sinks and tubs that don t drain and have gross stuff backing up  and gross stained couch and chairs  The kitchen is equipped with dishes but not any salt and pepper  oil  hotpads  or any other cooking basics  I was pretty disappointed in my stay  Very dirty apartment even after it was  clean  
752871979,Read the reviews   Spend the extra few dollars and stay somewhere else   The apartment was cute and the location was super convenient  but thats the only good thing about this place   Despite the not so great reviews  I gave this place the benefit of the doubt thinking it wouldnt be that bad   It completely reeked of stale weed  cigarette smoke to the point that it was unbearable and nauseating  I kept the window open the whole time to try and air it out some  but it didnt help much  I used the washer and dryer to try and rid my clothes of the smell before leaving  and even they somehow smelled like it too  I thought it was ironic that they had a  No Smoking  sign inside of the place   Also  the neighbors were having a rap sesh at      am one morning  and the other morning a woman was screaming  hitting  and kicking the walls outside of another apartment at      for at least    minutes   One of the extra blankets they offered also had a giant yellow stain on it  Gross   If you dont mind the smell and noisy neighbors though  go for it as it is in a great location  Thanks for the stay  May I suggest doing something about the stale cigarette  weed smoke   I know its most likely coming from the neighbors  but it was unbearable and nauseating  Maybe add a disclaimer or offer a more reasonable price  I almost cancelled my stay there because of it  but didnt want to only end up getting a quarter of what I paid back  and instead opened the window and slept on the couch just to have fresh air  Also  one of the blankets had a big yellow stain on it  Gross  Even the washer and dryer that I used to wash my clothes to try and rid them of the smell reeked of it too 
754169586,Not really nice  Condo was not locked when we arrived  Closet door hanging  Hallway smelled of smoke  No bath soap  Old furnishings  Old coffee grinds in coffeemaker  Nothing to make it stand out as a place you want to be  Doorlock confusing  Condo wide open when we arrived 
755561807,The unit was not clean  The fridge had dried up juice at the bottom and sticky drippings on the floor  The ventilation system did not work also the ceiling had mold from what looked to be water damage  The bedroom door had a whole in it the bed was full of hair and the bedroom closet had dried gum in the wedges  The bathtub had not been clean it had dried up soap residue and hair all over it    guess the clean fee is money well spent  Not to mention this was a totally different unit than advertised in the photos when I booked  This stay was totally unacceptable  I sent in photos  messaged in dozens of times and was only offered for someone to come tidy up and on top of that I was still charged full price  This was a totally different unit from what I requested and booked and when I reached out to the host  I was told that it was when the whole decor  furniture and floorplan layout was different from the pictures  Upon arrival the stove had  crumbs on it  the fridge had red dried juice in the door shelves and at the bottom  their were also sticky drippings on the floor  The ceiling had mold from what looked to be water damage  There was a hole in the bedroom door  The bed was full of hair  as well as the bath tub and floor  The tub also had dried up soap residue  The bedroom closet door had dried gum in the wedges  Which makes me question why your company is charging a clean fee   The host replied but was not much help  The dirty unit and the host being unwilling to assist  also the A c unit didnt work
754139446,There was a mixup and they double booked us with another group and we did not have anywhere to stay for one night  However  they did give us a refund for that night and made steps to ensure something similar wont happen again
755580215,We weren t able to get in the place wasn t as clean as expected and while they were responsive on some issues they could use some adjustment on how you get in and get out Do you know the glitch which is two things number one place was not very clean it smelled funny seconds him we couldn t get in and out and that system you have for the door code does not work you need to come up with a different method for letting people in because that one that doesn t work
758109772,Could have been better overall
572524541322086239,nope I have pictures of clusters of pubic hair in the hallway and in the elevator waiting area on the  th floor  The night before I left  there were shards of glass on the elevator left by the clean crew  You need to watch the clean crew  because those people are making   person do the majorityof the work while the restof those lazy fucks sit against the wall relaxing  Saw it twice   and yes  they were all black  I was in the same situation    years ago   Youre saving money on clean  but in the end its going to cost you  Eat shit all the way until your noy is Turdville  not leaving a bad review   but you need to have a rover to check the situation in your common areas 
759277765,Worst Airbnb experience I ve ever had to the point where I more than likely won t be using this service ever again   I reached out to both Airbnb and the host directly about extremely loud construction noises that were impacting my ability to work remotely   despite me putting in my initial request that that was the purpose for my trip  I wasn t even able to get on conference calls because I couldn t hear  The construction was daily from  am to  pm and ran all week  I wish I could upload videos to share   With that said  I reached out in a timely manner and just stopped hearing from the host altogether and have been bounced around through several  help  assistants from Airbnb  The host tried to offer     of the nightly rate back which after Airbnb s astronomical fees  was less than      for a weeklong stay that was unworkable for my sole purpose of being there    Terrible  terrible service  If you re planning to book with Zencity  don t waste your time or your money  Their lack of communication impeded me from options to relocate and actually be productive during my work week   From the fees to the customer service issues to hosts buying up properties and jacking up prices  Airbnb is starting to become what it allegedly wanted to change about the hotel industry and you hate to see it    I m only giving two stars because the apartment was cute and the bed was comfortable 
758558310,The Airbnb was filthy  The host had good customer service 
767289813,This property did not live up to our expectations  The lights did not work in the kitchen  TV only got limited stations  washer machine did not work and we were missing a towel and had to go purchase one   Even the carpet in the hallway was disgusting dirty  The whole experience was not good  Excellent location but that was it  This property has not met our expectations and lacked attention  Lights in kitchen did not work  were missing a towel and had to go buy one because after calling and seeking help yet no towel showed up and yes we have permission to enter the unit 
768339233,The pictures are of the unit  The unit has a very strong urine smell  The toilet is not safely secured to the wall or the floor so it rocks  The room was NOT clean  The location was great 
758114611,Horrible communication and response time if you have any issues  The check in process is horrible I couldn t get in through the intercom box and had to wait for security to let me in and door to the apartment code didn t work that you all sent me 
757080580,I stay in a lot of Airbnbs for work and travel and this was one if the worst  The carpet in one of the bedrooms was dirty and when we arrived the window was open  letting in the cold and rain  The latches on the window did not lock  and when I tried to report it  I was given no help  The place was minimal to the point of soullessness  Dont stay here  just get a hotel  Its not worth it for the price   I will never stay here again  It was a horrible place with dirty carpet and a broken and open window  The place had no amenities and was completely soulless  The carpets were dirty and the window was open   broken
756823494,Decent Whoever is clean isnt taking the time to thoroughly go through and actually clean and wipe everything down  The floors were disgusting Floors looked like they hadn t even been swept  it was picked up and organized but not clean
424461460627734699,This was my worst stay with Air BNB  The host was very responsive at the beginning when booking  I asked to stay later than the original   am check in  They mistakenly charged me for a whole other night instead of the     for staying late  They then took over    hours to respond when trying to get it refunded  Upon arrival check in was super simple and the place is keyed entry which is nice  When I got to my room at first things looked fine but a closer look proved otherwise  The sheets on the bed still smelled like someone s cologne  Definitely had not been washed or changed  The floor wasn t vacuumed  crumbs everywhere The windows had cobwebs  and the curtains were filthy  I couldn t stay  I booked the next flight home and was refunded  No way I could stay in there  Please actually get this room clean  The surface clean is not enough  Sheets should be changed after every guest visit  The should probably be a mattress cover as well  Curtains are dirty  Shades are dusty  Surfaces in the kitchen are not clean  This is such a safety hazard  Especially with COVID 
