id,concat_comments
414417996713726753,Overall i would not recommend   the place was not sufficiently clean  internet and television were not working  trip hazzards leading into the kitchen  drywall falling apart    However the location was great with some good restaurants in walking distance  Salt and smoke was the highlight of our stay We appreciated your hospitality     However  the television would not work  leading into the kitchen is a MAJOR trip Hazzard the place was not sufficiently clean pubic hairs in the shower  and a mound of dust on the vent right at front door   we absolutely loved the location  Salt and smoke was a   star    But overall from the drywall being cracked and falling apart to the floors being uneven and seperating and the trip hazzards  Unfortunately we would not stay again and would respectfully not recommend it to other travelers  With it being      for two nights we at least expected a clean environment and the internet to work so we could enjoy movies once we were done exploring the city 
392753545543977280,Cockroaches  filthy stained couch  wobbly furniture  shower in first floor leaks  gnats insects were present daily in the basement bathroom  code was changed twice by Zencity without notice to me and I got locked out twice   One of the two washing machines was  not operational and both dryers were out of order during my one week stay   I reported everything to Zencity and they offered me a partial refund of the clean fee for all my troubles  I paid over        for one week    Ridiculous and worst experience Ive ever had with an AirBNB rental   In the grand scheme of things  the fact that there is no coffeemaker is not a huge deal  but pointing it out in case  any of you consider that an important part of a rental   It was more of an annoyance that there wasnt a coffee maker given all my family and I dealt with  but some people are serious about their coffee so throwing this in for good measure   Other than the location of this rental  this was really the worst apartment rental ever  and I never give bad reviews  I just dont return to products or services that Ive not been happy with but this one seriously needed to be reported   Please review the many messages I sent during my stay regarding all the issues I reported   getting locked out because the code was changed more than once without telling me  cockroaches in the apartment that I reported and no one sent to address until the day before my departure  broken  wobbly  filthy furniture  etc   Its all in my messages and in the refund request I submitted along with a detailed explanation of what I reported during my stay 
434791285825146910,The condo is very well laid out and bright  Furnishings are very nice  Bed is comfortable  Location is downtown and close to great restaurants  One grocery store downtown a few blocks away  Parkade is across the street  Gym is very good  Pool area very nice   We had several issues though     Poor communication with management  Messages sent were answered much later or not at all  If there was a crisis we would have been left in the dark      One fob provided  Needed for elevator and room of course  Very hard to plan around one fob and   people  I asked for another and they replied much later that it s not possible      Fob for parkade was fine  But a strip with barcode is provided to enter and exit parkade  Instructions only say to use at entrance and exit  Could NOT find scanner  Asked management via message  Was told to use at entrance or exit   Had to ask another vehicle leaving parkade  You in fact have to hold barcode up onto windshield  Scanner is on ceiling by exit  Impossible to see or know without being told      Bed was sloppily made  Toilet was not clean  No cleaner or brush to clean it  Floors dirty  Walls had several foot prints  hand prints  Paintings missing on walls  Lamp not working      No coffee maker or kettle in a beautiful kitchen  Asked about this and was told to feel free to use anything else in kitchen  Coffee maker would be a great plus  A toaster would be great too      Limited towels  Only one in kitchen      Huge walk in closet    hangers      Dryer sensor is not working  Dryer kept turning off and on  Condo is a great space  Here are the issues     poor communication  and delayed replies     fob with scanner was not explained as seen in text to you  Have you actually gone into parkade to see how it operates  We had to ask another vehicle for assistance  It is NOT clear      cleanliness  bed was not made well  Floors and toilet were dirty  No toilet brush or cleaner to keep it clean  Walls were covered with hand prints  Foot prints as well  Paintings or pictures missing on walls  Lamp not working      kitchen is advertised but not equipped with a kettle or coffee maker  This would have been great to have  Toaster would also be great  Why offer a kitchen      carpet was not clean or vacuumed enough      not enough kitchen cloths or towels to dry dishes      one fob for a couple   We had to plan our departures and arrivals around   fob  Not convenient at all      no hangers in closet      something wrong with dryer  possibly the sensor 
464963391778048606,I could not gain door buzzer access to the apartment building to even check in to my Airbnb this company rented out  They then told me They refunded my money  But it s currently being investigated by the Airbnb resolution center as a scam  I have course have yet to see my       I have yet to get the refund for the room that I could not gain access to  The resolution center with Airbnb is currently investigating it as a scam 
423203679214939295,it was okay for a last minute stay  the blinds are broken in the living room  the window sill in the hall needs some work  the bathroom door doesnt shut right  the front door didnt lock right  their towels looked dirty glad I brought my own  and the oven looked as if it hadnt been clean in months
428909576474329750,There as no hot water in the shower and they did not send anyone to check until mid afternoon the day before I checked out  There was someone else s hair smeared on the side of the shower  I had to call them to get the door passwords because they didn t email me anything in a conformation  Literally a borderline scam  Don t go here
426616785531471045,Im not sure if this was just an anomaly  but my reservation was delayed an hour for clean  so I dragged my bag to a museum to kill time  When I returned  the intercom system did not work as detailed by Zen  I could not get into the building without looking like a suspicious person  and I certainly could not leave after that because I would have to rely on strangers going in and out  So I talked to Zen on the phone and the guy was very helpful  but there was only so much he could do  apparently  So I dragged my bag to a local restaurant and waited another   hours while a repair crew was supposed to remedy the problem  Nothing was changed when I returned  so I asked for a full refund and canceled the trip  Before canceling  I was supposed to have contacted AirBnB directly  which I honestly thought I had  So when I got home  I did receive a refund from Zen  but not from AirBnB  So another hour on the phone was spent with a different helpful person  but you could sense they didnt want to give me anything for all of my trouble  After persisting  I did get a full refund and a small credit toward another AirBnB in the future  Im not sure my time was worth all of this trouble  I appreciated the support I received on the phone  but ultimately I had to cancel the trip because it was far too long to wait to even get in to the building  which never happened 
436934744418829221,This trip was uncomfortable and the accomodations were disappointing  The unit looked nice but still had cheap leaning furniture  The air unit needs to be fixed it blows hot air and the wifi barely works  I didnt appreciate the way the company handled the communication with us either  I would suggest renting another property  its not worth the hassle  It takes almost an hour to connect to the host  Maybe the worst rental Ive stayed at and Ive been all over with Airbnb This trip was uncomfortable and the accomodations were disappointing  The air unit needs to be fixed and the wifi barely works  I didnt appreciate the way your company handled the communication
439760199387659154,I was very disappointed  A couple days before checking in I had contacted the host for any possibility of checking in earlier  check in is at  pm   they didn t get back to me  So the day of check in we ended up arriving       assuming everything would be ready for us to check in  Unfortunately that wasn t the case  the receptionist informed us that she didn t have the key to the apartment  since they were still clean it inside  We received the key       mins later  Once we went inside the airbnb we expected it to be clean However   we took a look inside   it was very dusty   shower did not look clean  I would recommend if cleanliness is not top priority but location is  Also communication with the host sucks 
454389446662874766,I would not stay with zen city if given another choice  As other reviewers noted  it s impossible to get into the building without asking for help from a resident  When we finally made it to the unit  there was no fob  We cancelled the stay at that point since we couldn t leave and reenter the building or unit easily  The check In system makes it impossible to have a relaxing stay 
396389720826695251,Unless they fix what they are saying  Don t trust this company  Place was dirty  no pillow cases  just not a place or company I would use again      Coming from someone who was born in       raised in Hyde Park  Father a huge professor head of the foreign language department at U High laboratory schools  I have the email from zen city showing I was to leave the keys on the table  Since there were only Two tables in the entire  what use to be a one bedroom turned two  Normal logic would say put keys on coffee table  Which was what we did  Until that is resolved  I will not give a good  or bad review 
400659522955631200,Shower drain did not work as well as toilet flushing  Brought it up with the owner and they ignored me  Also window AC couldn t keep up with the heat
423157471331079154,The unit is nice and the area is decent  some nice restaurants within walking distance    Please do not rent this unit  Our unit had   bath towel per bathroom  no shampoo soap and a dirty rag hanging in the shower     Zencity is an awful  awful management company  I requested early check in for noon  it was accepted  I got to the unit at        There was no fob in the lockbox  instructions followed perfectly  I called Zencity and messaged on the app and sent an email to their email address on their website  I spoke with a woman and she said she d call me back in five minutes  I waited   hr and    minutes and called back  A man answered  He told me he was also going to call me back in   to    minutes  Nothing  I waited until      as maybe they forgot about the early check in  Still no fob  I tried calling  and Zencity blocked my number from getting through    I used my brothers phone and got through and eventually after   hours of waiting  someone helped me    Everything negative about the unit posted in the reviews is true  The kitchen dining table chairs are not safe  they collapse if you lean back too far  The couch is ripped    These are all easily fixable things but Zencity is horrendous and doesnt care 
421641194252583850,I am writing in regards to the condition of the AirBnB that i checked into on August  rd  It has not been a good night so far   First  when i checked in they are doing construction on this floor and the smell of paint and lacquer have kept me up all night and giving me a constant headache  Second  I can send you a photo but the air conditioning is not working in this apartment   The only thing that works is the fan on the air conditioning system  Also there is a leak in the hallway pantry which is causing water to get on the floor   I want to reserve the room for a second night  but theres no way in the world I can deal with the smell I havent been able to fall asleep its just really annoying  Oh  and when i sat on the edge of the bed  the slats would come loose and i would fall through  So o wrote to see if it Is possible to extend my reservation for another night and go to a different building or unit  I then asked if it was possible to get a discount because of the inconvenience  As soon as I ask that question Ive never heard a single word back  I wrote three times asking about that and asked if it was possible to get a late check out  I got no response  And when I would try to call the customer service number I would get what sounded like a home answering machine  I called a total of    times  Every time I got the answering machine  Then when I left a message and somebody called me back and asked me to call them back  I ended up calling another twenty two times getting the answering every single time  Im sorry but this is stupid    Thank You I am writing in regards to the condition of the AirBnB that i checked into on August  rd  It has not been a good night so far   First  when i checked in they are doing construction on this floor and the smell of paint and lacquer have kept me up all night and giving me a constant headache  Second  I can send you a photo but the air conditioning is not working in this apartment   The only thing that works is the fan on the air conditioning system  Also there is a leak in the hallway pantry which is causing water to get on the floor   I want to reserve the room for a second night  but theres no way in the world I can deal with the smell I havent been able to fall asleep its just really annoying  Oh  and when i sat on the edge of the bed  the slats would come loose and i would fall through  So o wrote to see if it Is possible to extend my reservation for another night and go to a different building or unit  I then asked if it was possible to get a discount because of the inconvenience  As soon as I ask that question Ive never heard a single word back  I wrote three times asking about that and asked if it was possible to get a late check out  I got no response  And when I would try to call the customer service number I would get what sounded like a home answering machine  I called a total of    times  Every time I got the answering machine  Then when I left a message and somebody called me back and asked me to call them back  I ended up calling another twenty two times getting the answering every single time  Im sorry but this is stupid    Thank You
400669361732048761,N A I m writing to you regarding our recent visit to your property at     W Belmont on          Although the room was clean and as expected upon arrival  we were very quickly disappointed and upset for the remainder of our stay  We ran into a huge issue when we realized that the AC was broken  No matter what approach we took to turn it on  it remained completely shut off  This made our nights virtually unbearable  It was in the   s in Chicago and we had to try and sleep in an     degree room throughout the evening  Opening windows only made the problem worse as it didn t cool anything down and the train noises woke us up just as we were able to fall asleep    I reached out to your company to come and check out the AC unit on     in preparation for our second night  I received a response asking if someone was allowed to come in and take a look  I responded that we d be out of the room for most of the day and we re expecting someone to come take a look while we were out  However  after returning home we realized no one had been in the room and it was just as we left it  AC unit still broken   We were most upset that we were told someone would come fix the issue and no one did    This situation is unacceptable and we are planning to write about our experiences in an online review  We would consider not posting anything if you can give us some sort of refund for our stay  It s not fair for us to pay      for a room where we were only able to sleep   hours each night at the properties expense    I look forward to hearing back 
423945244996413243,Not the best check in procedure and they were not able to find a solution  It took them over   hrs to try and get us in  We were never able to check in because the keys were not in the location we were told  It took them over   hrs to figure out a solution and by then we had already made arrangements to stay elsewhere 
412495207845666813,Fuck this place they will still your money  They will purposely leave you in pending status for review  the minute you book another airbnb   pay for it  they will ignore your withdraw or cancellation request for booking   charge your account then send you checkin instructions   the address to the property  Key word the host here will do this directly after you cancel withdraw your booking request also   I believe airbnb helps them because there waz no withdrawal option for this host but I was able to withdraw with no problem with another host who took to long to respond    leaving me with no other option but the cancellation request   I sent a message because I thought it was odd that the withdraw request was not available   note this was all done before any acceptance  address of property   check  in information  They still took my money told me I dont get a dime back  so I paid      for two airbnb   only stayed in one of them for two days  I could have stayed home   paid my mortgage for that amount  my husband   I just had left his step dads funeral   we were sad   flustered   decided to get a airbnb for a couple of nights because we didnt want to bring that energy home to our kids  this host will fuck you with no vaselune   airbnb will help them In order to leave a review I had to enter atleast   star bur this airbnb did not deserve that  I never stayed at this property didnt go nowhere near it  They left me in pending approval status   waited until I booked   paid for another airbnb   withdrew   canceled my request to book with them to accept me   send me checkin instructions and stole my money out of my account  Airbnb helped them steal the money   the said a host has    hrs to respond to a request   thats fine but if a customer cancels or withdraws before a location or checkin instructions is provided   airbnb   the host knows that another airbnb has accepted   you are using their airbnb instead  A FULL REFUND IS A NO BRAINER   So fuck this host   airbnb the fraudulently scheme to still potential customers money   they refuse to give it back  I know I am not the only person this has happened to I can see a class action suit coming for Airbnb in the near future   I promise to be the first in line
426790844217863241,The checkin instructions are not valid for this unit   Ava sent me a message with the instructions  but things fail on the first instruction   I immediately messaged Ava Zencity  and never got a reply   After about an hour  a clean lady in the building took mercy on me and walked me up to the unit to try the  rd instruction   That worked   Once I had the key  I could come and go as desired   The unit itself is very boutique ish   In most cases  it was very clean sterile   However  there was some kind of padding or tissue that was very wet on the nightstand   It also looks like someone kicked in the bottom of the bedroom door     Ultimately  I would stay here again if the entry instructions were updated and accurate  The checkin instructions are not valid for this unit   I messaged Ava yesterday when I tried to get in   She still hasnt replied   It took me almost an hour to get past the front door  and that was just because a clean lady decided to help me   None of the tenants were willing to assist   That hour was critical  causing me NOT to be able to attend the Negro League Museum before it closed at     The cleanliness comment   There is some kind of wet pad or tissue or something on the night stand  and there was a little bit of other clutter that looked like it had been left aside   The card key is on a lanyard  but has tore away from the lanyard and is a lost card waiting to happen   Lastly  it appears that somebody kicked in the bottom of the bedroom door 
395645893702887245,No room number posted outside of door  hard to find room  Also  the code to get in the building didn t work  Security guard had to let me in  Code to get into building didn t work  Called and messaged about issue with no communication  Security guard had to let me in  Also  room didn t have room number listed outside of door so it was hard to find 
400731467030343198,DON T DO IT  We booked an apartment with Zencity for our    year anniversary  When we checked in  there was no fob left in the unit which allows access to the building enables the elevator  After messaging through the app  calling and waiting on hold and messaging calling through Instagram  We finally got someone to answer and we re told they would call us back  Got no call back when we were supposed to and we re forced to get a hotel room for the first night  We were told the second day at around noon that a fob was left at the front desk but when we asked the front desk  no one had been given anything  After that Zencity refused to communicate with us despite multiple phone calls and messages  The apartment was what we expected but if your trip is important  don t book with Zencity  I can t believe after leaving us without a place to stay the first night that you would continue to ignore communication attempts until after the trip was over  Terrible customer service and really surprised that you conduct business this way 
446961481308115528,This apartment needed a lot of repair  I d call it a fixer upper   It was very disappointing and we did not stay  not even one night   The cleanliness of this apt was very bad  Grime on doors and shelving  hair along the hall floor and baseboards  crumbs and dirt on the kitchen floor  fingerprints and smudges on the mirrored side table and glass coffee table  The large rug looked worn and stained and the venting in the bedroom was thick with dust  lint and sticky grime   No pride in this apartment   The walls showed wear and tear  ceiling was damaged  had stress cracks and the paint was sloppy  thick  gunky  caked on and chipped in places   Ceiling  light over table had three of  five working bulbs  Entrance way and another light fixture also had missing or non working bulbs  Electric light switch in hall did not completely covered the hole housing the electrical wiring   a gap between plaster and hole   The inside front door knob and lock also was ill fitted  and did not make one feel secure  In addition  there were three different doors gate to enter the apt  This was very cumbersome and would require two hands  The directions to entry gate did not include the first code at all   The instructions also directed guest to walk  up  the steps which was on east side of building  when they should have said walk  down  the steps   the west side of the building    The balcony looked appealing but the doors to access were so heavy making it difficult to open  Also there was a bad smell ruminating from below the pool looked to be the color green   algae   I sent many pictures to the the host in hopes of receiving a total refund  To this date I have only received about a third of it   My husband would have preferred to sleep in our car rather than to stay at this Airbnb  We checked into a holiday inn and the next day found another Airbnb  Very disappointing  Unable to stay at this Airbnb   The apt needed a lot of attention  Cleanliness was very poor  grime  hair along floor and baseboards  crumbs on kitchen floor  stains on surfaces  dust  noticeable finger marks and prints on side and coffee table  soiled carpet  venting in bedroom  thick with dust  lint  sticky grime   This apt needed a lot of repair  No pride in this apt  Walls were damaged  ceiling had stress cracks  paint was gunky and sloppy   many places were marred and chipped   Ceiling lights had missing bulbs or light bulbs were burned out    Three codes for three different doors gate required to get into this apt  Very cumbersome  Host had to troubleshoot problems over the phone to guide us into entry  Instructions to access apt were not accurate  no code for gate  directions to first gate were incorrect   The balcony looked appealing but the patio door was heavy and difficult to push open  There was a bad smell from the pool directly under the balcony and the pool looked to be green  maybe algae   I sent many pictures to the host in hopes to obtain a total refund   We simply could not stay at this Airbnb  My husband and would have preferred to have slept in our car  instead  we found a hotel room and then another Airbnb  This place needs a lot of attention and repair 
423188199130559957,The place was very nice   clean  Beds were comfortable  But the customer service part was horrible  We got locked out multiple times  had to wait outside for over   hours to wait for someone to bring up a keypad to back into the building  Other then that everything was great  Please work on communication with customers  we waited for   plus hours  to hear something back from Someone  Also we were locked out of our Airbnb multiple times   had to set outside with our children   had to wait over an hour for someone to drop off a key pad to get in the building 
