id,concat_comments
541995361550282313,Everyone should know the building is not a safe place to be at night  There s a lot of drug activity  The main door is not kept locked when it is the key fob doesn t work to get you in  I have photos of coke or heroine bags outside the elevator door  Room      had their door open all night with a creepy man watching you go to   from your car  The shower road was broken   the hot water NEVER worked  I ran it for    min from faucet   shower   it was out  I was approached to buy drugs   was made fun of by the door man when he thought it was funny to make me wave up and down at a motion censor that wasn t their to open the door  There was no good apology   all they offered was a next stay discount   I ll tell you I ll never go back there ever  I ve stayed at several in many big cities all with their own problems   this was horrific  Save you re money   get away from that place  FrontDesk   Bradley s are so much better You already know my problems 
450697134729325628,I want to give a good review but I can t  The apartment itself is great  In a great location and the building has AWESOME amenities  if only you had access to them  The fob doesn t work to get you into the gym or many of the common areas   On top of that  the internet password was correct but it said no internet connection  I reported the problem immediately upon check in and it was unresolved all   nights we were there with no one trying to make it right  All I got was  are you sure you put in the correct password   And  did you try restarting to router   OBVIOUSLY I did both of those things several times   No internet no tv on top of the disappointment that we couldn t access the amenities  VERY disappointing experience and bad communication from the host  Take care of your guests when they report issues  Not having internet or tv is a major inconvenience 
476110021261682289,Home was beautiful  Check in was easy  Getting in door after hours sucked  The intercom did not understand what was being said  I was very clear and wasnt sure where the mic was  But it said speak into the mic  Oh well  moving on   They need to hire new housekeepers  They left dirty towels behind the bathroom door  Sewerage smell was coming from bathroom  Wasnt sure from where  Kind of hard taking a refreshing shower and it smells  That was a first  Did inform the owner and was told sorry and my next stay could be discounted  Not sure I would come back here  Check in was easy  The home was beautiful  Got to the room it was dirty towels in the bathroom hanging on the door  It smelled like a sewerage in the bathroom  Had to keep the bathroom door closed the whole time doing my stay  Did inform him by sending pictures  Had to go to the store to get clean supplies to clean and disinfectant everything  So i didnt feel clean here at all 
386828351573162310,Muy mala experiencia  desde que llegas al vest bulo el edificio huele muy mal  una vez que entras q la suite es peor porque se ve que tiene poco uso as  que huele much simo a humedad  el ba o est  sucio  con residuos de jab n o pasta dental en el lavabo  cabellos en el piso y lo peor de todo fue que en el area del espejo hab a una lanceta para medir glucosa     Le escrib  al host y me dijo que sent a mucho que hubiera encontrado as  la unidad  pero que al d a siguiente ir a una persona a limpiar     As  que tuve que pasar la primera noche ah   en esas condiciones  obvio al d a siguiente deje el departamento  No lo recomiendo para nada a n y cuando esta bien ubicado ya que la zona es bonita Muy mala experiencia  desde que llegas al vest bulo el edificio huele muy mal  una vez que entras a la suite es peor porque se ve que tiene poco uso as  que huele much simo a humedad  el ba o estaba sucio  con residuos de jab n o pasta dental en el lavabo  cabellos en el piso y lo peor de todo fue que en el area del espejo hab a una lanceta para medir glucosa     Le escrib  al host y me dijo que sent a mucho que hubiera encontrado as  la unidad  pero que al d a siguiente ir a una persona a limpiar     As  que tuve que pasar la primera noche ah   en esas condiciones  Una lastima ya que esta ubicado en una zona bonita
542048171553561431,Be careful  They will try to take your money with false clean claims  All drains were clogged and the whole building smells like smoke 
480443927881216574,I canceled my reservations   days in advance  I was billed       The host is refusing to provide me with my refund  I contacted Mark with the Airbnb resolution center for assistance  He was to cancel my reservations since the Airbnb website would not allow me to complete the cancellation process  The host was included in the message thread regarding the cancellation process  Mark with Airbnb Resolution Center did not complete my cancellation  He is a failure at his job and actually blocked the entire thread regarding our conversation  I have an open investigation with Airbnb  I have reported both the host and Mark with Airbnb  I have been dealing with this issue for   days at this point and I have yet to receive a refund from the host  I would never recommend this host or any property associated with Zencity  I would also recommend that anyone dealing with Airbnb take screenshots of everything pertaining to Airbnb communication   Airbnb seems to be as shady as some of the hosts  I never thought Airbnb resolution center would actually DELETE BLOCK conversation threads and leave the customer holding the bag  Theives are everywhere      Since I canceled my reservation and you still owe me my refund I have nothing but bad things to say about you as a host  Pay me my refund  I have an active claim with Airbnb  She is conducting an investigation  My reservation was canceled   days before my check in date  I can t control the Airbnb platform and why I was unable to supply you with a cancellation confirmation  Mark with Airbnb Resolution Center stated that he would complete the cancellation process for me  He failed in providing me with a cancellation number which is again  out of my control  You received the same messages  from him as I did  I have reported his poor performance to Airbnb as well and he is part of the investigation process  You are well aware that you owe me my refund  You billed me          Give me my refund 
542073838966222509,communication with the host might be spotty Would like a refund  had to cancel this because our key fob wasn t available for us to pick up  so we had to find a new place to stay  what are the next steps for a refund
475384751691610939,Be ready to hike once you park  it will be at least two blocks  Give yourself plenty of time to check in  you will likely run into issues  I was very disappointed with our stay  Checkin was a nightmare where we were able to check into somebody else s room for two hours  I am not sure if that room was clean before the next guests arrived  I had revived an email that said if we  had any questions or concerns to let you know  Once we finally got into our room I expressed the concern of safety  I never got a response  We stayed four days with no response at all until an automated message on the morning we left  The tub did not drain at all  which I couldn t tell anybody because nobody got back to me  Nobody should have to stand in a foot of dirty water from the pipes while they shower 
529022727894276258,Do not rent this place unless you dont have much to carry   It is clean and very comfortable but to much of a hassle to deal with the key fob that doesnt work   Couldnt get downstairs to play pool like it is advertised in the app   One lady in the office was a snot to my husband but changed her when Iwalked in the office  There needs to be something done about the poor service with the key fob   I couldntget back into the garage after I parked    I wanted to bring in the rest of my things and couldnt get back to my truck because the key fob wouldnt work   Poor communication for sure 
514452863896288089,The last day we had there they kicked us out at    am and we didn t get to come back in till the day was over  Even tho I paid for it  Other then that it was okay but I will never pay for that again The last day we had there they kicked us out at    am and we didn t get to come back in till the day was over  Even tho I paid for it  Other then that it was okay but I will never pay for that again
473121320899293095,Very disappointing  Amenities listed  such as the gym  pool  coffee bar  games courts  etc were not available to Air BnB guests  Seemed to be the policy of Zencity to block  On site unaffiliated building personnel told us it had been that way for quite some time  Amenities were open  but we couldnt access Location is good  but price we paid was for the amenities  Zencity was not responsive at all during our stay of of   days  During our trip  only communication was that they were unable to accommodate early check in due to another guest  and check out instructions on the final morning  This was despite several attempts via phone and app to reach them starting   hour after we first checked in  very disappointed in the lack of response during our stay to the immediate feedback we offered shortly after check in of amenities that were listed not being accessible  further  feedback we received from the local leasing agent  who could not help is  was that this did not seem to be an error  rather  a policy of Zencitys to not offer access  this was directly contrary to the listing  as well as even the welcome communication we received day of with the check in info  Other feedback   better instruction on need to use the fob to lock the door when leaving would be helpful  and if was initially a little hard to find the lockbox with the fob  describe a bit better where to find it at  add a few more utinsels to the kitchen  like a coffee maker  cutting board  etc 
746165073,Location in CWE was great as well as the apartment concept   Apartment needs clean and updating   At the time of our visit  the microwave was not functioning  feedback already provided via messages between host and me directly hardwood floors do not appear to have been washed other than being swept or vacuumed in quite some time   some surfaces appear to have been wiped  but others had not
743368844,This may have been an insolated incident being that the entire apartment wasnt clean  but it was unacceptable that this company didnt have cleaners available the day of my check in to come and clean  They were scheduling for next morning clean which meant I would have to sleep in a filthy apartment  I cancelled and am awaiting a FULL refund  Ended up spending      extra dollars to book a last minute hotel room  Disappointed from this experience Please refund me  This may be an isolated incident  but it was unacceptable for me to stay there and I must let other positions know truthfully of my experience Apartment looks like what was in it  just a lot of wall scuffs and sagging furniture Hairs in bed  shoe prints and debris in shower  should and water stains on counters and living room end tables  floor not swept or mopped  sink dirty in bathroom  no trash bag in bathroom trashcan  food debris left in fridge Call center type of contact
455008755950715819,Honestly  this place was pretty awful  First  we arrived to check in and could not get in  The entire screen on the pad to type everything in was froze  We called our  host  which is a call center for the entire Zencity  not a specific person  that had no idea who I was or anything about my airbnb stay  He literally was zero help and the only reason we got in    minutes later was because we caught the door when someone came out  Next  to be brief   the bed in this airbnb is old and worn  We didn t even feel comfortable getting in it because it looked so dingy  The bedroom also reeked of cat urine  We ended up buying an air mattress unfortunately  Pretty much the trip was an overall disaster  Kitchen and bathroom was pretty clean and up to date  Bedroom is awful  Checking in was TERRIBLE  Communication was TERRIBLE 
480453089297115351,Great location  but not very clean 
515210872683294661,Dirty dog hair was all over the key fog to get in apartment took    mins Couch was full of dog hair   key fog is not easy to get
478314910960882800,The key drop box wasn t working so I had to wait an over hour just to check in then once I got to the room the tv did not work  other than that it s a nice place  
453591491114609896,HORRIBLE   PRICE WAS DECENT   NO TRASH BAGS  BED WAS UNCOMFORTABLE     GAVE US THE WRONG DOOR CODE  AND A BAD SMELL TO BOOT   PAY A LITTLE MORE AND FIND A BETTER PLACE     
541375283953661277,Unfortunately this was not the experience that we were hoping for  I waited TWO HOURS after check in time waiting for a key to get into the air bnb  I was never able to get a key  and to top it off the building was being evacuated after the fire alarms were activated  We had to rearrange our plans for the night due to the inconvenience of not being able to get into the air bnb  After waiting so long and STILL no promise of even getting a key for the night I cancelled our reservation  I was very disappointed because I was looking forward to staying in this air bnb  Even though customer service was not able to help  I will say they responded in a timely manner  If you decide to stay here  I would be cautious and have them verify a key is there and available before you check in 
500691383711592969,Overall stay would have been phenomenal if we had hot water for longer than just the first day there  I reached out multiple times  even contacting Airbnb support  getting to the point where I just had to call the office of the complex so someone could finally resolve the problem   Also in regards to the toilet leaking into the below apt the following morning of our arrival  the plumber walked in unannounced  hours later    stated he  didn t know the place had guests    Location was the main good thing considering the elevators reeked of marijuana as well  Overall stay would have been phenomenal if we had hot water for longer than just the first day  I reached out multiple times  even contacting Airbnb support  to where I just had to call the office of the complex so someone could finally resolve the problem   Also in regards to the toilet leaking  the plumber walked in unannounced  hours later  while everyone was still in bed   stated he  didn t know the place had guests  
499317250545252240,The room was clean   The location was great   The cost was affordable   The check in process was a complete and utter disaster   For the first room       I had  the apartment building key card was not available   This made it impossible to get to my room   I was told that at     pm that the housing     team would contact me to get me the card   They didnt contact me by      pm   Turns out they leave for the day at  pm    After   phone calls and   hours of wasted time late at night  I finally got checked in   I basically had to beg to get transferred to another room  evidently their support staff couldnt come up with that solution on their own     The check in process was completely unacceptable  it is the last thing you want to deal with after a late dinner  Be sure you have the key card for check in   For the first room       I had  it was not there   This makes it impossible to get to my room   I was told that at     pm that the housing     team would contact me   They didnt by      pm   Turns out they leave for the day at  pm    The check in process wasted   hours of my time late at night and was completely unacceptable   I basically had to beg to get transferred to another room 
495646468480600577,DO NOT STAY HERE   From the photos this place looks like a steal  but once you arrive you will soon realize how poorly maintained the place is     My wife and I arrived around      and were immediately hit with smells of weed and cigarettes in the hallway   Not pleasant  but we can t expect management to be able to control the neighbors   Once we walked into the apartment we were wishing for the hallway smell as the entire apartment had a stench of rotting garbage   It felt like some didn t take the trash out for months  and showed of right before we arrived to remove it   As we walked around the place we noticed unclean floors and countertops  area rugs that should be trashed  and to top it off sheets that smelled like the previous guests   As we were debating on whether or not to stay or find a hotel  we noticed human nails in rugs next to the bed as well as pieces of glass near the coach    Clearly this was not the place for us to stay the night  and we left for a nearby hotel   I brought this up to the management group and their response was  ohh well   and  we will refund the clean fee    It was so dirty that we couldn t stay there a refund of the clean fee was an insult   I highly recommend that you keep scrolling to the next option 
465290503584795811,Our experience was not good  We had an issue upon check in with a smoke detector beeping  We were unable to reach the detector and deferred to Zencity for a resolution  We were advised the following day that they couldn t have someone available on the weekend to help  We spent the entire first night trying to sleep through a beeping every    seconds  We were advised through Airbnb to cancel as we went to get a hotel room for the  nd night  The issue still isn t      resolved and the communication has been terrible on Airbnb and Zencity  This trip has verified we are done with Airbnb and will book through hotels moving forward  Our experience was not good  We had an issue upon check in with a smoke detector beeping  We were unable to reach the detector and deferred to Zencity for a resolution  We were advised the following day that they couldn t have someone available on the weekend to help  We spent the entire first night trying to sleep through a beeping every    seconds  We were advised through Airbnb to cancel as we went to get a hotel room for the  nd night  The issue still isn t      resolved and the communication has been terrible on Airbnb and Zencity  This trip has verified we are done with Airbnb and will book through hotels moving forward 
465230494908816165,First this place is not safe  there was an incident that made us feel extremely uncomfortable and vulnerable  the police were contacted twice and never responded  I messaged the host and they didn t get back to me until the next day and all they had to say was that they d notify their team so they could  keep an eye out   Upon arrival the home was dirty  I sent multiple pictures to the host and got no response  The amenities were very minuscule  no trash bags  a coffee pot and only two plates  It s extremely loud due to the location  traffic  and the neighborhood  The night of the incident we stayed in the car until early morning  I do not refine d this place  for lock of safety  cleanliness and lack of concern from the host 
465216896642263648,This air bnb was awful    The instructions to enter the building did not work  We did not even get a key fob to access the building once we got to the room  Zencity was impossible to contact and when they answered they could not even offer any help  I would not stay here  The instructions to enter the building did not work  We ran into another couple trying to check in to their air BnB who had similar issues not being able to access their room  A resident of the complex was kind enough to let us in  but once we got into our room we were promised a fob that gets us inside the building and up the elevator  After not being able to locate the fob  it was nearly impossible to contact Zencity for help  Once they finally answered they had no way of helping us with our problems so we were scared we would have to sleep in our car if we did not catch a resident entering the building when we were coming back  They did not help us all weekend or offer any sort of refund for the lack of communication and not being able to access our room ourselves 
465135616008079051,The irony of calling their company  ZenCity  is not lost on me  We were not only highly annoyed but we were also then late for our engagement  also needing to find a new place to stay for both nights where we could guarantee re entry into the building  and also on the phone with ZenCity staff who by no fault of their own  are in no way helpful  Just entering the building is the most stressful thing  I generally enjoy Airbnb experiences  but I have now learned my lesson to only do Airbnb from actual individual owners and not these ill named corporations who run Airbnb properties  What an embrasement for Airbnb   First of all  do not book this  But if you do  do not follow any instructions they send you about getting into the place  Even if you call them and ask them to clarify because you read the reviews about it being hard to get in  it wont matter  They will say its easy to get in  They will say instructions are forthcoming  And you believe them because  what self respecting company gets multiple reviews saying theyve made it difficult to get into the building without remedying the situation  But Im not entirely convinced that anyone at ZenCity visits this apartment to know how to actually enter the building  On the keypad  you need to dial your apartment number in the directory  not the other number they give you  From there  the code they send you MAY work  IF you get in that way  they then recommend you walk around a desk and through a mailroom to find a key fob at a kiosk that does not exist  Meanwhile  the elevator to get you upstairs only stays unlocked for you for about two minutes  So while youre looking for the unicorn key kiosk  you get blocked from getting up the elevator  Fortunately  if you get there before the leasing office closes  the kind worker  who is embarrassed to have ZenCity in their building  offers to let you up the elevator to the apartment but is  of course  unable to provide access to the apartment  So you will stand there with all of your things while you wait for  Zen City to answer the phone and feign shock that you cannot get into their place  saying   We at ZenCity are not known for this   all while providing no real solutions  When they finally found a code to get us in the room  we asked how we would get back into the building  and they suggested we wait outside for someone from the  front desk  to let us in  This is NOT true  The desk  like the kiosk  is fake news  And how is that a solution for trying to re enter a building at midnight in downtown KC anyway  Why would they find this an acceptable solution regardless  Were supposed to just HOPE someone arrives and lets us into the building  No  Fortunately  we found a place to stay  The actual apartment is small with water dripping from the toilet  Its otherwise modest but cute I guess  and absolutely NOT WORTH IT  I dont know who you are reading this much of my review  but I do know that you  lovely human  deserve much much better  I suggest you send someone to the building to actually create instructions on how to get into the building and rooms  NOTHING about your instructions to enter the building are correct 
460138667349307754,You get what you pay for here and the prior reviews regarding the check in and the call box are correct  I had to tailgate in the building as the call box does not work as given by the instructions  The area is nearby mostly hotels in the area and office building but a shot walk away from the touristy spots 
460807462801271095,Apartment itself was nice and clean  the communication was good in the beginning  We got responses back within an hour or so  However that changed Once we got to the property  Getting in the building was very difficult and someone who lives there actually let us in the building  We had talked to the security in the building for help  He told us that the intercoms do not work and that we ll need a key fob to get in and out of the building as well as the elevator  The security was able to let us up the elevator  When we got to the unit  the key fob was no where to be found  We immediately contacted zencity and they told me that someone will deliver the key fob ASAP  We waited around for   hours for the key until we absolutely had to leave for our dinner reservation  Again  when we got back  we had to explain the whole situation to the security again so he can let us up the elevator  That night  we received a message saying that the property manager did not have an extra key fob so they will not be able to provide one for our entire stay  On Sunday  we got back to the property and asked the security to let us up the elevator  The security told us that they can not do that anymore because of the protocol  We were scared that we will not even be able to get our stuff from the unit much less staying another night  We ended up having to sneak in with someone to get to the unit  We packed up our stuff and got a hotel room for the rest of the night because it was too stressful and scary that we do not know if we will be able to get back in the unit after leaving  So this might be something you might want to consider before renting through them  They also took     hours to respond back to my request or questions after the check in 
